id,title,plot,mpaa
0111333,The Swan Princess,"As children, Prince Derek and Princess Odette are forced to spend their summers together by their widowed parents, who hope that the two will eventually fall in love and marry, so their two kingdoms will be united. As children and adolescents, Derek and Odette can't stand each other, but as young adults they begin to see each other in a different light and fall in love with each other. But one night things take a bad turn when Derek unintentionally offends Odette, who then refuses to marry him if he can't prove that he loves her for who she is and not just her beauty. Odette and her father are then attacked by Lord Rothbart, a vengeful sorcerer who was cast out of William's kingdom when he plotted against the king. In the form of a beast, Rothbart mortally wounds William, and kidnaps Odette then places her under a spell. Now it is up to Derek to rescue Odette by showing his undying love. But will he be in time?As children, Princess Odette and Prince Derek hated the thought that someday they would be forced to marry. Yet, as they grew up, their looks as well as their feelings for each other changed. However, in one night everything goes wrong, Derek makes an insulting remark, and Odette vanishes. With everyone believing her dead, Derek is the only one who will not give up hope, using what little clues he has to track down whatever took the princess. Meanwhile, in a secluded ruin, an enchanter with an eye for Odette's kingdom has turned the beautiful maiden into a swan. She may only remain in her human form when moonlight touches the lake she's imprisoned beside. As the two search for one another, they learn what it takes to make a vow of love that can last for eternity.A power hungry sorcerer transforms a princess into a swan by day in this tale of everlasting love.",G
0063385,Oliver!,"Musical adaptation of Charles Dickens's classic tale of an orphan who runs away from the orphanage and hooks up with a group of boys trained to be pickpockets by an elderly mentor.In Victorian England, Oliver Twist is the name given by a workhouse warden to a boy born in the workhouse orphanage, Oliver's mother who died in childbirth and whose identity is unknown. Now an adolescent, Oliver, who has never felt loved or accepted, manages to escape from both the harsh workhouse and his equally harsh placements ""for sale"". Managing to make his way to London, Oliver, feeling accepted for the first time in his life, is welcomed into a group of other young boys, headed by the Artful Dodger, who ""make wallets"" under the direction of Fagin. What Oliver is initially unaware of is that they are really a band of pickpockets, Fagin who hides away whatever riches he is able to obtain for his own personal benefit. One of Fagin's associates is the violent Bill Sikes, whose girlfriend, Nancy, is devoted to him despite his abuse of her. Oliver looks to Nancy as his one true friend, especially needed when he discovers what Fagin and the boys actually do. Oliver also comes to the attention of the wealthy Mr. Brownlow. Out of circumstance, Bill sees Oliver as both an asset and a liability, but one that needs to be kept enslaved under his direction. Nancy has to decide whether to be loyal to Bill to help him keep Oliver, or do what is best for Oliver by helping him escape, especially as she knows that Brownlow is looking for Oliver when he learns of Oliver's true heritage.9-year-old orphan Oliver Twist falls in with a group of street-urchin pickpockets led by the Artful Dodger and masterminded by the criminal Fagin. When Oliver's intended mark, Mr. Brownlow, takes pity on the lad and offers him a home, Fagin's henchman Bill Sikes plots to kidnap the boy to keep him from talking.Oliver Twist is sold to a Dunstable undertaker after asking for more dinner at the orphanage. Escaping to London he is taken in by Fagin to join his gang of child pickpockets. Wrongly accused of a theft he meets a more kindly gentleman who takes him in, to the concern of one of Fagin's old pupils, the violent Bill Sykes. In the middle is Nancy, Sykes' girl whom Oliver has come to trust.After being sold to a mortician, young orphan Oliver Twist runs away and meets a group of boys trained to be pickpockets by an elderly mentor.",G
0247638,The Princess Diaries,"Mia Thermopolis is the average teenager - sweet, a little geeky and pretty much invisible to everyone with the exception of her mother, best friend Lilly and Lilly's older brother Michael. Making it through high school without throwing up is a challenge in itself for Mia, so it doesn't come as welcome news when her estranged grandmother shows up out of the blue and calmly informs her that she is in fact the heir to the throne of a European country called Genovia. Suddenly Mia's life is thrown into complete overload. She's being taught about scarves, waves and pears in order to become a perfect princess, she gets a makeover and a tough looking yet sweet bodyguard/limo driver called Joe. Things get out of hand when the media gets a hold of the story and suddenly Mia is thrust into the spotlight in both the newspapers and in school. On top of all that Mia has a choice to make. She must decide by Genovia's Independence Day Ball whether she longs to relinquish her claim on the throne or to become the princess and heir to the throne her father and grandmother want her to be.A socially awkward but very bright 15-year-old girl being raised by a single mom discovers that she is the princess of a small European country because of the recent death of her long-absent father, who, unknown to her, was the crown prince of Genovia. She must make a choice between continuing the life of a San Francisco teen or stepping up to the throne. While Mia makes up her mind, she's pressed into taking princess lessons from her grandmother.Mia, an awkward San Francisco teenager, has just learned her deceased father was the crown prince of Genovia. To keep the royal reigns from passing to another family due to a broken bloodline, the queen seeks the favor of her estranged granddaughter in hopes that she will take her father's place as the crown princess. While Mia contemplates her future, her grandmother insists on turning her from a social misfit to a lady fit for the throne. What these two discover about each other is that blood is more important than bloodlines.Mia Thermopolis has just found out that she is the heir apparent to the throne of Genovia. With her friends Lilly and Michael Moscovitz in tow, she tries to navigate through the rest of her sixteenth year.",G
0120363,Toy Story 2,"While Andy is away at summer camp Woody has been toynapped by Al McWiggin, a greedy collector and proprietor of ""Al's Toy Barn""! In this all-out rescue mission, Buzz and his friends Mr. Potato Head, Slinky Dog, Rex and Hamm springs into action to rescue Woody from winding up as a museum piece. They must find a way to save him before he gets sold in Japan forever and they'll never see him again!Woody is stolen from his home by toy dealer Al McWhiggin, leaving Buzz Lightyear and the rest of the gang to try to rescue him. But when Woody discovers that he's actually a valuable collectible from a once-popular television show called ""Woody's Roundup"" and is reunited with his horse Bullseye, Jessie the yodeling cowgirl and his faithful sidekick, Stinky Pete the Prospector, he doesn't want to leave.Whilst Andy is at summer camp, Woody is accidentally placed in a yard sale. Al, a greedy toy collector spots him and sneaks away from the yard with the toy. Whilst Woody is meeting up with new toys, Jessie the cowgirl, Stinky Pete the prospector and Bullseye the horse, whilst Buzz Lightyear and the rest of the toys enter the real world outside the house to find him.In ""Toy Story 2,"" the fun and adventure continues when Andy goes off to summer camp and the toys are left to their own devices. Things shift into high gear when an obsessive toy collector kidnaps Woody who unbeknownst to himself is a highly valued collectable. It's now up to Buzz Lightyear and the gang from Andy's room - Mr. Potato Head, Slinky Dog, Rex and Hamm - to spring into action and save their pal from winding up as a museum piece. There's plenty of excitement and fun as the toys get into one predicament after another in their daring race to get home before Andy does.TOY STORY 2 picks up sometime after TOY STORY left off. Andy is having a yard sale. A broken toy penguin named Wheezy is thrown in a selling box. In a rescue attempt, Woody gets Wheezy back. Unfortunately, Woody is left behind in a box and is stolen by a greedy toy collector. In an all-out rescue mission, Buzz and the gang try to get Woody back. Adding to the conflicts is the toy collector is soon selling Woody to Japan.When Woody is stolen by a toy collector, Buzz and his friends vow to rescue him, but Woody finds the idea of immortality in a museum tempting.",G
0413895,Charlotte's Web,"Based on the beloved children's novel by E.B. White, a young girl named Fern rescues a runty piglet, raises it as her own and names him Wilbur. However, after Wilbur grows into a pig, she is compelled to sell him to her Uncle Homer Zuckerman down the street. At Zuckerman's barn, Wilbur meets a host of animals and later learns from them that come winter, he will be slaughtered for food. Fearing for his life, Charlotte, a gentle and wise spider whom befriended the lonely Wilbur, vows to save his life.Wilbur the pig is scared of the end of the season, because he knows that come that time, he will end up on the dinner table. He hatches a plan with Charlotte, a spider that lives in his pen, to ensure that this will never happen.",G
0095776,Oliver & Company,"Inspired by Charles Dickens' ""Oliver Twist"". A homeless kitten named Oliver, roams the streets of New York, where he is taken in by a gang of homeless mutts who survive by stealing from others. During one of these criminal acts, Oliver meets a wealthy young girl named Jenny Foxworth. This meeting will forever change his life.A young cat named Oliver is left alone in a kitten box, while all the other young cats have new owners. A big dog named Dodger shows him how to get food and later Oliver lives with him, his owner Fagin and Fagin's other dogs Tito, Rita, Einstein, and Francis. Fagin has one problem besides being broke he owes a nasty man named Sykes a lot of money. If he can't pay it back he's in big trouble. While Oliver runs into a little girl named Jenny who becomes his new owner which he is happy with and later Sykes sees Jenny as the key for him to get his money.A lost and alone kitten joins a gang of dogs engaged in petty larceny in New York City.",G
0108526,We're Back! A Dinosaur's Story,"Captain New Eyes travels back in time and feeds dinosaurs his Brain Grain cereal, which makes them intelligent and nonviolent. They agree to go to the Middle Future (this era) in order to grant the wishes of children in New York city. They are to meet Dr. Bleeb of the Museum of Natural History, but get side-tracked with their new friends and run into the Captain's evil brother, Professor Screw Eyes, who has other plans for the dinosaurs.Captain New Eyes travels back in time in what is presumably the Late Cretaceous Period. He feeds the four dinosaurs named Rex, Elsa, Dweeb, and Woog his Brain Grain cereal, which makes them intelligent, nonviolent, and gentle. They travel via spaceship to the twenty-first century where they befriend a street-smart and tough-talking, but secretly soft-hearted boy named Louie, and a wealthy, but neglected girl named Cecilia from the wrong side of the tracks. They get rooked into performing in a demented circus run by the scientist's evil brother named Professor Screw Eyes who has twisted plans for the dinosaurs.",G
0032455,Fantasia,"Disney animators set pictures to Western classical music as Leopold Stokowski conducts the Philadelphia Orchestra. ""The Sorcerer's Apprentice"" features Mickey Mouse as an aspiring magician who oversteps his limits. ""The Rite of Spring"" tells the story of evolution, from single-celled animals to the death of the dinosaurs. ""Dance of the Hours"" is a comic ballet performed by ostriches, hippos, elephants, and alligators. ""Night on Bald Mountain"" and ""Ave Maria"" set the forces of darkness and light against each other as a devilish revel is interrupted by the coming of a new day.An innovative and revolutionary animated classic from Walt Disney, combining Western classical music masterpieces with imaginative visuals, presented with Leopold Stokowski and the Philadelphia Orchestra. The eight animation sequences are colorful, impressive, free-flowing, abstract, and often surrealistic pieces. They include the most famous of all, Paul Dukas's ""The Sorcerer's Apprentice"" with Mickey Mouse as the title character battling brooms carrying endless buckets of water. Also included are J.S. Bach's ""Toccata and Fugue in D Minor""; Tchaikovsky's ""Nutcracker Suite""; dinosaurs and volcanoes in Stravinsky's ""Rite of Spring""; the delightful ""Dance of the Hours"" by Ponchielli with dancing hippos, crocodiles, ostriches, and elephants; and Mussorgsky's darkly apocalyptic ""Night on Bald Mountain.""A collection of animated interpretations of great works of Western classical music.",G
0114148,Pocahontas,"This is the Disney animated tale of the romance between a young American Indian woman named Pocahontas and Capt. John Smith, who journeyed to the New World with other settlers to begin fresh lives. Her powerful father, Chief Powhatan, disapproves of their relationship and wants her to marry a native warrior. Meanwhile, Smith's fellow Englishmen hope to rob the Native Americans of their gold. Can Pocahontas' love for Smith save the day?Capt. John Smith leads a rag-tag band of English sailors & soldiers to the New World to plunder its riches for England (or, more precisely, for Governor Ratcliffe, who comes along for the ride). Meanwhile, in this ""New World,"" Chief Powhatan has pledged his daughter, Pocahontas, to be married to the village's greatest warrior. Pocahontas, however, has other ideas. She has seen a vision of a spinning arrow, a vision she believes tells her change is coming. Her life does indeed change when the English ship lands near her village. Between Ratcliffe, who believes the ""savages"" are hiding the gold he expected to be plentiful, and Powhatan, who believes these pale newcomers will destroy their land, Smith and Pocahontas have a difficult time preventing all-out war, and saving their love for each other.An English soldier and the daughter of an Algonquin chief share a romance when English colonists invade seventeenth-century Virginia.",G
3606752,Cars 3,"Blindsided by a new generation of blazing-fast racers, the legendary Lightning McQueen is suddenly pushed out of the sport he loves. To get back in the game, he will need the help of an eager young race technician with her own plan to win, inspiration from the late Fabulous Hudson Hornet, and a few unexpected turns. Proving that #95 isn't through yet will test the heart of a champion on Piston Cup Racing's biggest stage!Racing is starting to become tough for Lightning McQueen, as he is becoming one of the oldest race cars on the race track and a generation of new rookies are coming into the racing world. For Lightning to prove that he is still a top racer, he is going to need help from an eager young female car named Cruz Ramirez, who is to help and train Lightning. He's not quitting until he shows he is still a top racer.Lightning McQueen is happily winning all of his races until a new generation of high-tech racers are trained. They all zoom past McQueen, leaving him fading behind. Jackson Storm, a new-gen, wins four times in a row as McQueen pushes himself too hard and crashes. In order to get back on the race track, he needs training from a young racing technician at the Rust-eze Racing Center, Cruz Ramirez. Cruz and Smokey Yunick, the former engineer for the Fabulous Hudson Hornet, help McQueen best they can. With cheering from Mater, Luigi, Guido, and Sally, McQueen could possibly beat Storm in the Florida 500 by learning a few tricks from the history of the Fabulous Hudson Hornet.After Lightning is outsmarted by Next gen racers, he crashes in the final race of the season. Now, if he is going to beat Storm, he is going to need help from Cruz Ramirez, a young female racing trainer. Though they will have to travel through hard obstacles first.Lightning McQueen is a 7 time piston cup champion,but become blindsided by an arrogant rookie named Jackson storm,Lightning must recover from his crash and receive help from a young trainer named Cruz Ramirez and inspiration from the fabulous Hudson hornet,#95 is about to enter the biggest race of his career and become a champion again.Lightning McQueen sets out to prove to a new generation of racers that he's still the best race car in the world.",G
0064603,The Love Bug,"Meet Jim Douglas, a down-on-his-luck race car driver who lives in an old run-down fire house in San Francisco with his friend Tennessee Steinmetz, a occasional drunk mechanic. One day, Jim goes to a luxury car dealer and sees a strange Volkswagen Beetle with a unusual problemOn a long losing streak, the down-and-out race car driver, Jim Douglas, is convinced that he only needs a big and strong car to start winning again. Unexpectedly, fortune will soon smile on him, when he discovers a second-hand Volkswagen Beetle while looking for a cheap car downtown, however, Jim will get more than he bargained for, as his new acquisition seems to have a mind of its own. Before long, ""Herbie"", Jim's temperamental race car, will start winning one race after another, driving crazy its previous owner, the snotty car salesman and seasoned race car driver, Peter Thorndyke, who will do anything in his power to find his rival's secret. Naturally, now Thorndyke wants his old car back, but Herbie and Jim have other plans, including winning the demanding El Dorado road race. Can this incredible duo thwart its opponent's plans?A race car driver becomes a champion with a Volkswagen Beetle with a mind of its own.",G
0096283,My Neighbor Totoro,"Two young girls, 10-year-old Satsuki and her 4-year-old sister Mei, move into a house in the country with their father to be closer to their hospitalized mother. Satsuki and Mei discover that the nearby forest is inhabited by magical creatures called Totoros (pronounced toe-toe-ro). They soon befriend these Totoros, and have several magical adventures.When two girls move to the country to be near their ailing mother, they have adventures with the wondrous forest spirits who live nearby.",G
1217213,Secret of the Wings,"Tinker Bell finds herself crossing into the Winter Woods. There she meets Periwinkle and together they find the magical powers that their wings obtain. They have to save the Pixie Tree from a dark winter, but something horrible happens to Tinker Bell, will the wing power fix it?Tinkerbell wanders into the forbidden Winter woods and meets Periwinkle. Together they learn the secret of their wings and try to unite the warm fairies and the winter fairies to help Pixie Hollow.",G
0084237,The Last Unicorn,"From a riddle-speaking butterfly, a unicorn learns that she is supposedly the last of her kind, all the others having been herded away by the Red Bull. The unicorn sets out to discover the truth behind the butterfly's words. She is eventually joined on her quest by Schmendrick, a second-rate magician, and Molly Grue, a now middle-aged woman who dreamed all her life of seeing a unicorn. Their journey leads them far from home, all the way to the castle of King Haggard...A brave unicorn and a magician fight an evil king who is obsessed with attempting to capture the world's unicorns.",G
0453451,Mr. Bean's Holiday,"Mr. Bean enters a church raffle and wins a vacation trip to France as well as a camcorder. After boarding a Eurostar train and arriving in Paris, the French language proves a barrier for Bean, as he struggles to get across the city to catch a train to the south of France from the Gare de Lyon. Taking time to order a meal, he finds the consumption of a seafood platter to be a challenge. Just before catching his train, he asks Emil, a Russian film director on his way to be a judge at the Cannes Film festival to use his camcorder to record his boarding, but accidentally causes Emil being left behind at the station. Bean attempts to cheer up the director's son Stepan as the train continues south but matters are made more hectic by the fact that Emil has reported his son to have been kidnapped and Bean losing his wallet and essential travel documents at a pay phone where he and Stepan attempt to contact Emil. Heading in the direction of Cannes, Bean finds himself in the cast and disrupting the flow of a commercial being shot by the egotistical director Carson Clay. He and Stepan finally hitch a ride with the young and vivacious actress Sabine who is heading to Cannes to attend the premiere of Clay's film, in which she appears. After Bean sneaks into the showing, his camcorder images are destined to enliven the proceedings.Much to his delight, the clumsy but mainly well-intentioned, Mr Bean, wins a trip to the South of France at the picturesque French Riviera, after entering a church fundraiser. Without delay, the loveable man-child Londoner sets off for a relaxing holiday at the sunny beaches of Cannes equipped with a brand-new video camera; however, it is not before long when Bean's dreamy vacations will turn into an odyssey of unforeseen consequences. Inevitably, on his journey across France to finally get to the beach, disaster will follow, but who knows what will happen when Mr Bean's wild adventure ends up at the renowned Cannes Film Festival. Will Bean catch a glimpse of the sea?Mr. Bean wins a trip to Cannes where he unwittingly separates a young boy from his father and must help the two come back together. On the way he discovers France, bicycling, and true love, among other things.",G
0493949,Ramona and Beezus,"Ramona Quimby, is a grade-school student with a big imagination. So big, in fact, that she often clashes with her no-nonsense teacher Mrs. Meacham. When Ramona's upbeat dad Robert loses his job, the family - including her teenage sister, Beezus, and their practical-minded mother - must make major adjustments, like dad learning how to run the house. Ramona dreams up various plans to make money so that she can save their house, but because everybody in the family seems too preoccupied to help her with her own worries, she turns to the one person who always has time for her, Aunt Bea. But even Aunt Bea is distracted these days because of her ex-boyfriend - and Quimby family next-door neighbour - HobartAn adventurous young girl uses her imagination to escape her reality, that is quickly spinning out of reach.",G
0051337,The 7th Voyage of Sinbad,"While sailing with Princess Parisa to Baghdad to their wedding, Sinbad finds the Colossa Island and anchors his vessel to get supplies for the starving crew. Sinbad and his men help the magician Sokurah to escape from a Cyclops that attacks them, and Sokurah uses a magic lamp with a boy jinni to help them; however, their boat sinks and he loses the lamp. Sokurah offers a small fortune to Sinbad to return to Colossa, but he does not accept and heads to Baghdad. The citizens and the Caliph of Baghdad are celebrating the peace with Chandra, and they offer a feast to the Sultan of Chandra. Sakurah requests a ship and crew to return to Colossa but the Caliph refuses to jeopardize his countrymen. However, the treacherous magician shrinks the princess and when the desperate Sinbad seeks him out, he tells that he needs to return to Colossa to get the ingredient necessary for the magic potion. But Sinbad has only his friend Harufa to travel with him, and he decides to enlist a doubtful crew in the prison of Baghdad, in the beginning of his dangerous voyage to Colossa to save the princess and avoid the eminent war between Chandra and Baghdad.When captain Sindbad and his men land on the island Colossa they are confronted with man-eating cyclops. They can escape with the help of the magician Sokurah and his magic lamp. The lamp which contains a boy jinni unfortunately gets lost. Back in Bagdad the magician performs impressive tricks. He wants to start an expedition back to Colossa to bringing the lamp back in his possession. But the kalif rejects the magicians requests. The malicious Sokurah breaks into the rooms of the princess at night and shrinks the princess to the size of an elf. The magician offers his abilities to heal the princess on next day. But one of the magic potions necessary components must be procured from the island Colossa first. So captain Sindbad sails again to the island Colossa and to the dangers expecting him there...When a princess is shrunken by an evil wizard, Sinbad must undertake a quest to an island of monsters to cure her and prevent a war.",G
