id,title,plot,mpaa
0035423,Kate & Leopold,"Kate and her actor brother live in N.Y. in the 21st Century. Her ex-boyfriend, Stuart, lives above her apartment. Stuart finds a space near the Brooklyn Bridge where there is a gap in time. He goes back to the 19th Century and takes pictures of the place. Leopold -- a man living in the 1870s -- is puzzled by Stuart's tiny camera, follows him back through the gap, and they both ended up in the present day. Leopold is clueless about his new surroundings. He gets help and insight from Charlie who thinks that Leopold is an actor who is always in character. Leopold is a highly intelligent man and tries his best to learn and even improve the modern conveniences that he encounters.Leopold is an English and broken baron living in New York in the end of the Nineteenth Century. He needs to get married with a rich fiancée to recover his family position from ruin. Kate is a successful businesswoman living also in New York, but in 2001. Due to a time incident, they meet each other in the present days and they fall in love to each other.An English Duke from 1876 is inadvertedly dragged to modern day New York where he falls for a plucky advertising executive.",PG-13
0081145,Me and the Kid,"Two ex-cons, Harry (Aiello) and Roy (Pantoliano) execute a robbery they think will net them $250k. When they find the safe empty, Roy, decides to kidnap Gary, the eight year old son of their victims. Gary's hypochondriac mother has told the boy he is allergic to everything, keeping the lad from having a pet, going anywhere or doing anything. The boy is even home schooled and therefore has no friends his own age. When frustrated Roy wants to hurt and later kill the boy, Harry protects and then runs off with the kid leaving Roy tied up. Naturally Roy is angry, and being rather psychotic, he comes after Harry for revenge. Meanwhile, Gary has formed a strong attachment to Harry and the two have a wild adventure and wind up hiding out at a motel owned by a former sixties flower child. She falls for Harry and wants to help him escape the law. Then trouble starts from two directions and Harry must make a difficult choice about the future - both his and young Gary's.A lonely and emotionally neglected rich kid forms an attachment to one of the men who kidnap him during a botched robbery of his father's safe.",PG
0094859,Chief Zabu,"In 1986 Howard Zuker and Neil Cohen directed their first and only film, CHIEF ZABU, a low budget, audacious socio-political comedy about New York real estate operators who scheme to take over a Polynesian country while its leader is in New York seeking admission to the UN. Featuring a cast of legendary character actors - Allen Garfield (The Conversation), Zack Norman (Romancing the Stone), Allan Arbus (Putney Swope), Marianna Hill (The GodfatherAn outrageous social comedy about a New York realtor who dreams of having political influence by taking over a new Polynesian nation.",R
0094900,Committed,"Pursuing a new job after the shattering suicide of her friend and employer, a nurse applies at Dr. Quilly's world renowned facility. The discovery that the 'routine forms' she signed are actually her own commitment papers is just the beginning of a nightmare of confinement, delusion and murder.A nurse is taken hostage by a patient pretending to be a doctor and is forced to minister to everyone.",R
0094926,Curse of the Crystal Eye,A man travels through Asia and Africa seeking the treasure of Ali Baba.,R
0096154,Spies Inc.,"Spies from different nationalities stationed in a small Asian island work out a plot to create an international incident taking profit from it. Defrauding CIA through fake reports and running a front company using operating funds, they control the island and use the skills acquired in the service of their countries to pursue their personal dreams of wealth and happiness.",R
0097631,Judgement,"A musically talented Chicano teen gets involved with a gang after a music teacher throws him out of a classroom where he snuck in too practice the piano. Aligning himself with the gang, they sneak back in and destroy the music room. This leads to more major crimes including a drive by shooting. A judge (Chelsea Walker) then tries to aid the boy, whom she does not believe is the standard gang member.A juvenile court judge goes out of her way to try to aid a young man whom she believes has innocently gotten involved with a gang.",R
0097775,The Master,"Uncle Tak, the old martial-arts master and medicine in normal life has severe problems with his former student Jonny, who wants nothing more than to kill his old master to show everyone who the real master is. Uncle Tak wants Jet, his best student, to come over from China to the US. Jet gets no green card, but finally manages to come as a tourist. Jet is not familiar with the American way of life, but all the better with the way of fighting.Uncle Tak, owner of the Po Chi Lum herbal shop was on his way home when bad-boy ex-student Jonny shows up challenging him to a match. Jonny has defeated and killed every master there is and is now trying to prove he is the best to his street-gang disciples by killing his own master in unarmed combat. A fight begins (with the shop getting halfway demolished in the process) and Tak is badly beaten and wounded. Anna, a young college student on vacation shows up and rescues Tak and takes him to her home to get better. Enter Jet, Tak's disciple, who remained in China because he was afraid to come to America. Finally getting the courage, Jet comes to L.A. where he tries to understand American customs and ways of life and to reunite with his master. But he gets sidetracked when the Barrio Boyz (Rolando, Chui and Fernando) take his bag after he gets off the bus and Jet chases after them (using gymnastic skills along the way). The Barrio Boyz are amazed with Jet's skill and ask him to be their teacher. Jet refuses and then he meets up with them again and helps them when a rival gang torches their home and bullies them. Jet decides to look after the Barrio Boyz and they in turn help him search for Uncle Tak. Things get even more hectic when he meets May Hong, a woman who Uncle Tak pays his rent money to at the bank so his shop can stay open. May is having problems of her own with her sleazy boss, Paul Lee and the fact that Jet is around the shop that she was suppose to foreclose on doesn't help matters either. May and Jet get off on the wrong foot twice when they meet each other, but they eventually learn to get along. When Tak and Jet are finally reunited, Jet teaches the Barrio Boyz some of his fighting techniques and together, the group prepares for battle when Jonny sets deadly sites not only on finishing Tak, but Jet as well. And pretty soon, Jet is forced to turn from student to teacher and the City of Angels will never be the same!",R
0097928,Murder Blues,"A detective becomes obsessed with bringing a man to justice, whom he is sure is a serial killer and the murderer of a woman with which both men were involved. However, the supposed killer may be as much a victim as the murdered people.",R
0098372,Spirit of the Eagle,A famous mapmaker and his eagle friend venture through the forests of America's Northwest territories.,PG
0098467,They Call Me Macho Woman!,"Tromatic Super Heroine Susan Morris has to learn to fend for herself when she decides to escape from the urban jungle. While looking for a charming house in the country, she falls into the clutches of a band of brawny brutes - Mongo and his crew of corporate cretins. A once sweet working girl from the city, Susan is pushed to her limits and becomes a fearsome female warrior. She escapes imprisonment from the gang and, craving revenge, metamorphosizes into a heroic woodland creature. Armed with instruments of steel and skills derived from primitive survival instincts, she repels the evil onslaught. Macho Woman has arrived!A young widow on a trip to the backwoods stumbles upon the operation of a gang of drug smugglers. They attempt to kill her in order to keep their operation a secret, but she turns out to be more resourceful than they thought, and starts to turn the tables on them.",R
0099059,The Arrival,"When an old man witnesses a strange meteor land, he finds himself growing younger, but his renewed youth has a price; he must kill or die. He is a vampire, but it is not blood he needs to satisfy his cravings. A series of murders in which several women are brutally slain leads the police on a confusing chase across several states.An old man, who has been near a fallen meteor, starts to get younger and younger, with a terrible thirst for blood.",R
0099184,Buddy's Song,Buddy is an aspiring teenager who is a very good musician and has pressure to go further than his Dad's teddy boy rocker days. However when his father is sent away for a year for covering up for criminal Des it puts further strain on the family relationship. When Terry is released things get steadily harder while Buddy's career gets rosier.,R
0099236,Chaindance,"A prison decides that the best way to rehabilitate a particularly troublesome prisoner is to chain him to the wheelchair of a rebellious, bad-tempered young man with cerebral palsy. The government rationale behind this is three fold. First it will help a terribly understaffed nursing home. Second, being chained to a handicapped person may inspire caring in the prisoner and third, it could help to toughen up the patients...As a part of a special government reform program, inmate J.T. Blake has to take care of Johnny Reynolds who has cerebral palsy. In the meantime, another inmate wants to take care of J.T. Blake forever.",R
0099295,Complex World,"The Heartbreak Hotel nightclub in Providence is having a busy nightTerrorists, political conspiracy, drugs and bad music. Just another night at the Heartbreak hotel.",R
0099312,Cover-Up,"Mike Anderson (Dolph Lundgren), a tough American reporter on a dangerous foreign assignment, finds his own life in jeopardy when he uncovers a deadly labyrinth of political intrigue that threatens the lives of thousands in the action thriller ""Cover Up"". Despatched to investigate a mysterious and fatal attack on an overseas US naval base, Anderson, a leading investigative journalist and ex-US marine, finds himself back on familiar ground. Instinct makes him question the official CIA explanation that cites an unknown terrorist group called Black October. Alone, and armed only with his combat training and determination to uncover the truth, he sets out to expose a complex and dangerous political web. Anderson quickly discovers he can trust no-one. Renewing a fiery affair with his ex-Iover Susan Clifford, now the US Embassy press attachee, he soon finds himself confronting an old adversary, CIA boss Lou Jackson. And when his former marine colleague Colonel John Cooper is murdered moments after a secret rendezvous with him, Mike realises he holds the pieces to a deadly plot. In a race against time, Anderson battles to save the lives of thousands of innocent people, in a desperate attempt to prevent a deadly plan to create an international disaster of catastrophic proportions.A tough ex-U.S. Marine journalist battles against time to save the lives of thousands of innocent people after uncovering a complex terrorist plot.",R
0099379,Deadly Dancer,"A police detective, investigating a string of murders of strippers at a Los Angeles night club, must race against the clock to clear his name when he's wrongfully accused of being the killer.",R
0099388,Deathstalker IV: Match of Titans,"It begins as a contest of strength the challenge of competition luring fighters from far away to a hilltop castle. Deathstalker leads the combatants but only to discover that the winners are disappearing one by one. Now, in his last and greatest battle, Deathstalker must defend his remaining comrades, his life, and his newfound love in battle against an evil army of stone warriors and the wicked queen who created them.",R
0099397,Defenseless,"The lawyer Thelma ""T.K."" Knudsen Katwuller is having a love affair with her client, Steven Seldes, accused of making under-age porn movies through the Blue Screen Production. When T.K. meets her old college friend Ellie Seldes, she finds that she is Steven's wife and Ellie invites T.K. to have dinner with her family at her home. T.K. decides to break-up with Steven and he asks her to meet him in his office. While waiting for Steven, T.K. finds that he owns the Blue Screen Production and had lied to her. The next morning, Ellie is arrested and accused of murdering her husband and Ellie hires T.K. to defend her. Detective Beutel feels that something is missing in the case.Lawyer T.K. represents Steven Seldes who claims he is innocent of involvement in making under-age porn movies. He is also her lover, so when she meets his wife things are awkward for her - he didn't say he was married and his wife turns out to be an old student friend. Next day she confronts him at his office and a fight ensues.A lawyer is hired to defend an old college friend accused of murdering her husband.",R
0099462,Dream Machine,"As a reward from a jilted millionairess, Davis is given the $100,000 Porsche of the unfaithful husband. Unknown to Davis and the wife, the body of the husband is in the Porsche. The killer tries in vein to recover the body before it is discovered.",PG
0099524,Evil Toons,"Four sexy young girls are to clean an old house for the new owners. They get delivered an old book full of magic incantations, and while reading it they accidentally bring a cartoon character to life. The cartoon character likes the blood of young girls...A group of four hot teenage girls must spend the night in an old haunted house in order to receive a large amount of money. On the night of their arrival, a strange man arrives at the house, delivering an old book. Once he is gone, the girls examine the book, where they find a sketch of a wolf-like monster! As time passes, the drawing emerges from the book and becomes an evil toon! At one point, eventually, the girls must do whatever it takes to make the monster return to the book.Burt has a cleaning company and hires four women to clean an isolated house. They find an old book, a dagger and a soul shred and when one of them, Megan, reads an incantation, she unleashes an evil beast in our world.",R
0099558,Armour of God 2: Operation Condor,Agent Jackie is hired to find WWII Nazi gold hidden in the Sahara desert. He teams up with three bungling women (the 3 stooges?) who are all connected in some way. However a team of mercenries have ideas on the ownership of the gold. A battle/chase ensues as to who gets there first. Lots of choregraphed Kung-Fu and quirky Chan humour.Jackie is a talented special agent who is used for dangerous undercover work. The government employs him to try and find some gold that the Nazis allegedly left in Northern Africa 40 years ago. He soon discovers that he is not the only one searching for the gold; there are people willing to kill to get their hands on it.,PG-13
0099577,Firehead,"A government agent assigns a scientist to help one of his agents track down a Russian defector who is a cyborg. Meanwhile, an organization known as The Upper Order is plotting to take over the world by using the cyborg's powers.When a Russian cyborg with telekinetic powers terrorizes a city, an elite government agency intervenes. Col. Vaughn convinces ""regular guy"" chemist, Warren Hart, to team up with a beautiful blonde agent to capture the menace. But Warren finds the true villain isn't who he expected. Forces of good and evil go head to head in this paranormal story of corruption and redemption...with the world's future hanging in the balance.",R
0099579,Fist of Glory,"During Vietnam War, a member of US special forces is shanghaied and forced to participate in an underground street fight tournament where losers die. His teammate discovers this and enters the tournament to save him and end it.",R
0099587,Flight of the Intruder,"After his bombardier is killed, Jake ""Cool Hand"" Grafton (Brad Johnson)', a carrier-based Intruder pilot, questions the purpose of Navy bombing missions. He finds an ally for his cynicism in Virgil Cole, a bombardier on his third tour of duty, and together they ponder the notion of one unsanctioned mission ""downtown"", to ""Sam City"" in North Vietnam.During the air war over Vietnam, a U.S. Navy A-6 Intruder bomber pilot schemes with a hardened veteran to make an unauthorized air strike on Hanoi.",PG-13
0099675,Going Under,International disaster looms as the USS Sub Standard has to race to get a nuclear weapon ahead of the Russian forces.,PG
0099741,Harley,"Harley is a 'troubled teen' from L.A. who is arrested. A progressive social worker has Harley sent to Texas to live with the Nortons, an open-minded, heartful Christian family, and spend two months on their ranch. Surrounded by a town full of doddering hicks, Harley takes on ranch chores, learns to ride horses, and finds love in a local girl while the Nortons try to bring him into the fold. Eventually Harley chooses to release his pain in exchange for a return to faith, culminating in his calling for God's help to save the life of the burglar who framed him.",PG
0099814,Hurricane Smith,"An oil-field worker from Texas journeys to Australia to look for his missing sister, and his search winds up getting him involved with a violent drug-smuggling gang.",R
0099982,Last Call,"As a little girl, Cindy had to witness how the shady estate agent Jason Laurence killed her mother. In the 22 years since then, he was never called to account for this crime. So Cindy decides to take vengeance herself. At first she gets a job as secretary for Paul's most important business partner. Paul is immediately attracted to the big-busted blonde and they start an apparently passionate affair. When his business suddenly gets into problems, his partners drop out and he gets bad press, he has no idea why...",R
0099984,The Last Match,Somewhere on an island in the Caribean a girl is imprisoned for owning drugs. As she is the daughter of a football team coach help is soon on the way,R
0100108,Cthulhu Mansion,"An aging magician harboring a terrible occult secret and his daughter are taken hostage in their isolated mansion by teenage scumbags need- ing a place to hide out. When the captors refuse to listen to the magician's dire warning to release him unharmed, the mansion slowly releases its nightmare of horrors on the unsuspecting invaders.",R
0100152,Mindwarp,"A young woman in a post-apocalyptic world rebels against the status quo, in which everyone lives their lives out in a virtual reality fantasy world of their own choosing... With consequences she couldn't have imagined.In 2037, after a nuclear disaster has just about destroyed the Earth, the planet's remaining dwellers retreat to Inworld, an enclosed biosphere where computers control all aspects of life. But a beautiful young woman rebels against the Inworld's pre-fabricated existence and demands the right to experience ""real"" life. So the biosphere's System Operator exiles Judy to the mutant-ridden outside world. Once there, she is kidnapped by deformed cannibals who want her to breed with their evil leader. Will Judy be able to escape the horrors of this futuristic, toxic wasteland?In post-apocalyptic 2037, Judy rebels against the AI-ruled utopia where people live in a happy VR simulation. She's exiled to a post-nuclear wasteland where she meets drifter Stover. Mutated cannibals capture them for their leader Seer.",R
0100172,Mom,"During a time when the city of Los Angeles is terrorized by animal attack style murders, a kindly elderly lady provides a nomad with room and board. It turns out that he is a werewolf and is responsible for the recent killings. He bites the elderly woman, turning her into a hungry werewolf. Now her adult son must try to prevent the both of them from doing any more harm.An L.A. man is shocked to discover that his loving and caring elderly mother has become a vicious werewolf.",R
0100175,Money,A young man whose father's fortune was stolen by his closest friends sets out to get revenge in this odyssey through the world's major financial centers.,PG-13
0100303,Operation Corned Beef,"Squale, an ace spy, is called back from South America to carry out a tough operation. Goal",G
0100342,Payback,An escaped con goes after a drug-dealing killer.,R
0100369,The Pit and the Pendulum,"It is the time of the Spanish Inquisition. Maria does not like what is going on during the ""Auto De Fe"". When she speaks out, she is arrested and accused of being a witch. Torquemada has plans for her! He orders her tortured, and her tongue to be cut out. Her husband attempts to free her...",R
0100393,The Last Butterfly,"Stage mime Antoine Moreau (Tom Courtenay) is compelled by the Gestapo to put on a performance for the children of Terezin, a ""model"" concentration camp, to convince the Red Cross observers that the camp is truly what it seems. Reluctant at first, Moreau slowly learns the true nature of the camp, including the meaning of the ""transports"" on which people leave. With a world-class orchestra (made up of people interned in the camp) and a cast of children, Moreau stages a show to end all shows.",PG-13
0100430,The Psychic,"The college student Patrick Costello shares an apartment with his childhood friend Nick and has a crush on his professor Laurel Young. Patrick has premonitions through dreams and daydreams since he was a kid and recently he is foreseeing the deaths of young women. He succeeds on dating Laurel and soon he learns that she is also dating her friend and also professor Theodore ""Ted"" Steering, who is the serial-killer wanted by the police. Now Patrick seeks evidences to prove that Steering is a killer to protect his beloved Laurel, but nobody believes in his words. When Steering invites Laurel to travel with him to another town, Patrick has premonitions with her becoming his next victim. What can he do to save Laurel?A serial killer is terrorizing a small college town. When a student begins to have psychic visions of the killer with clues as to who he is, he gives this information to the police - only to find that he himself is suspected of committing the murders.",R
0100488,Rich Girl,"A rich Beverly Hills girl gets a job as a waitress, and falls in love with a rock singer.",R
0100491,Riff-Raff,"The story of Stevie, a construction worker, and his girlfriend, an unemployed pop singer, serves to show the living conditions of the British poor class",R
0100504,Rock 'n' Roll High School Forever,"Those rambunctious kids are back in school and back in trouble in a smash sequel to the 1978 worldwide hit. Corey Feldman leads a rock and roll rally at Ronald Reagon High, but must triumph over the evil plans of the school's fascist principal, Vadar, who wants to halt the school dance and run their school like a prison.",PG-13
0100528,The Runestone,"A Norse runestone is discovered in Western Pennsylvania. The prophecy upon it tells of the Norse great wolf Fenrir (Fenris), and that its release from the stone will bring about Ragnarok --- the end of the world. Archaeologist Sam Stewart and wife Marla find it has some connection to their friend Martin. A young boy named Jacob is haunted by terrifying nightmares of what is to come, and his family explains these dreams through stories from Norse legend, which says that the only one who can destroy Fenrir is Tyr, the Norse god of war, who is prophesied to return to fight the creature.",R
0100688,Steel and Lace,"Daniel Emerson is acquited of the rape of classical pianist Gaily Morton, and part of the blame for the acquittal lies with the testimony of Daniel's friends Norman, Oscar, Toby, and Craig, who all helped Daniel rape Gaily. Still devastated by the rape and unable to deal with the acquittal, Gaily commits suicide by jumping off of the top of the court building as soon as the trial ends, much to the horror of her brother Albert, who is a scientist. Five years later, Daniel has made Norman, Oscar, Toby, and Craig partners in his business, which forces homeowners and their homes out of the way to make way for bigger developments. By this time, after five years of working with Gaily's body, Albert has turned Gaily into a cyborg that is programmed to get bloody revenge on Daniel, Norman, Oscar, Toby, and Craig.A rape victim returns from the dead to seek vengeance on her rapists in this gory horror film.",R
0100765,The Terror Within II,"In a world gone mad, the last human colony struggles to survive underground, beneath a land of nightmarish mutants who seek to destroy them. But when the mutant breaks inside humanity's final stronghold, the battle for survival pits the human colonists against their deadly invaders a few miles below the Earth's surface.In a post-apocalyptic world full of terrifying mutants known as gargoyles, survivors of the last human colony battles against intruding gargoyles a few miles below the Earth's surface.",R
0100774,Thousand Pieces of Gold,"In 1880's China, young Lalu is sold into marriage by her impoverished father. Rather than becoming a bride, Lalu ends up in an Idaho gold-mining town, the property of a saloon owner who renames her China Polly and plans to sell her as entertainment for the locals. Refusing to become a whore, Lalu ultimately finds her own way in this strange country filled with white demons.",PG-13
0100786,Till There Was You,New York sax player arrives on the island nation of Vanuatu to find his missing brother. He learns that his brother had teamed up with a powerful shady foreigner and his femme fatale wife to find some sort of treasure.,PG-13
