id,title,plot,mpaa
0091790,Pretty in Pink,"Teenager Andie is one of the not-so-popular girls in high school. She usually hangs out with her friends Iona or Duckie. Duckie has always had a crush on her, but now she has met a new guy at school, Blane. He's one of the rich and popular guys but can the two worlds meet?Poor Andi is smart and sensitive but not popular in school. When she meets rich Boy Blaine, she thinks she's found true love. Unfortunately their friends don't think it will work. Can Andi and Blaine overcome the obstacles to lasting love? Jon Cryer costars as best friend Duckie in an unforgettable role.A poor girl must choose between the affections of dating her childhood sweetheart or a rich but sensitive playboy.",PG-13
0800369,Thor,"The warrior Thor (Hemsworth) is cast out of the fantastic realm of Asgard by his father Odin (Hopkins) for his arrogance and sent to Earth to live among humans. Falling in love with scientist Jane Foster (Portman) teaches Thor much-needed lessons, and his new-found strength comes into play as a villain from his homeland sends dark forces toward Earth.A war is waged between the frost giants and Thor's homeland. Loki fights for his right to the throne. Thor is cast out of Asgard by his father and sent to earth as punishment for his arrogance and disobedience in his battle. He loses his powers of the hammer until it returned to him on earth and he pulls it from the ground. In his fight for his own freedom on earth he meets a scientist; Jane Foster and has an affair with her. Thor then battles the evil forces of his brother Loki along with a robotic giant destroyer that attacks a town.After wanting to wage war against the Frost Giants, the mighty warrior Thor is cast out from Asgard by his father Odin and sent down to Earth. With no way home and his hammer Mjolnir lost, Thor struggles to reclaim his powers. Meanwhile on Asgard, Thor's devious brother Loki had seized the throne and seeks to help the Frost Giants reclaim their glory. With help from scientist Jane Foster and her team, Thor must learn the true virtue of being a hero and return home to stop Loki and save Asgard from destruction.The reckless Thor (Chris Hemsworth) son of Odin (Anthony Hopkins), challenges his brother's claim to the throne of Asgard. To teach him humility , Odin casts the young warrior down to Earth to live among humans. Robbed of his powers, Thor falls in love with a scientist Jane Foster (Natalie Portman). While Thor's brother; Loki usurps the throne of Asgard for evil gain and plans revenge, Thor's love for Jane and his lessons of humility turn him into the true hero and legendary and immortal warrior-defender of the peoples of the Earth saving them from destruction.The powerful, but arrogant god Thor, is cast out of Asgard to live amongst humans in Midgard (Earth), where he soon becomes one of their finest defenders.",PG-13
2674426,Me Before You,"Lou Clark knows lots of things. She knows how many footsteps there are between the bus stop and home. She knows she likes working in The Buttered Bun tea shop and she knows she might not love her boyfriend Patrick. What Lou doesn't know is she's about to lose her job or that knowing what's coming is what keeps her sane. Will Traynor knows a car accident took away his desire to live. He knows everything feels very small and rather joyless now and he knows exactly how he's going to put a stop to that. What Will doesn't know is that Lou is about to burst into his world in a riot of color. And neither of them knows they're going to change each other for all time.Louisa Clark is a small town girl who knows a lot about the people around her. Will is a quadriplegic man who hates everyone around him. Louisa is hired by Will's mum to take care of him for six months. Although they have a rocky start, their relationship grows over time, going for hate, to like, to love.The twenty-six year-old waitress of a cafe Louisa ""Lou"" Clark is a charming woman that lives with her parents Bernard and Josie Clark, her sister Katrina ""Treena"" Clark and her grandfather in a small town in the United Kingdom. Lou supports the whole family since Bernard is unemployed and Treena is a student. When she loses her job, she applies to the position of caregiver of the wealthy banker Will Traynor, who was hit by a motorcycle two years ago and became tetraplegic. Will's mother Camilla Traynor, supported by her husband Stephen Traynor, hires the inexperienced but happy Lou to take care of her son together with his nurse Nathan. When Lou meets Will, she finds a bitter, cynical and depressed young man that had lost the will to live. Further, she learns that the handsome Will was a successful athlete and banker. Will she lift his spirit?A girl in a small town forms an unlikely bond with a recently-paralyzed man she's taking care of.",PG-13
0109830,Forrest Gump,"Forrest Gump is a simple man with a low I.Q. but good intentions. He is running through childhood with his best and only friend Jenny. His 'mama' teaches him the ways of life and leaves him to choose his destiny. Forrest joins the army for service in Vietnam, finding new friends called Dan and Bubba, he wins medals, creates a famous shrimp fishing fleet, inspires people to jog, starts a ping-pong craze, creates the smiley, writes bumper stickers and songs, donates to people and meets the president several times. However, this is all irrelevant to Forrest who can only think of his childhood sweetheart Jenny Curran, who has messed up her life. Although in the end all he wants to prove is that anyone can love anyone.The movie Forrest Gump follows the life events of a man who shares the name as the title of the film. Gump faces many tribulations throughout his life, but he never lets any of them interfere with his happiness. From wearing braces on his legs, to having a below average IQ and even being shot, Gump continues to believe that good things will happen and goes after his dreams. While several less than ideal things occur during Gump's life, he manages to turn each setback into something good for him, such as when he finally gets his braces off he discovers that he is capable of running faster than most other people. This skill allows Gump to not only escape his bullies while he is a child in Greenbow, but also to gain a football scholarship, save many soldiers' lives and become famous for his ability. While Gump eventually achieves the majority of the things he hoped to throughout the movie, it proved a much more difficult task to win the heart of his life-long friend Jenny Curran. The movie is centered on Forrest Gump and the incidences that occur during his life, but during each period in his lifetime he thinks back of Jenny and how important she is to him. Although the two characters grew up together and shared a very close friendship, as the movie progresses they grow apart. This upsets Gump who cares immensely for the girl who had a rough start in life, and it seems the two always end up back in each other's lives, often in extraordinary ways like meeting in the Reflection Pond in D.C. Even though Gump is the main character of the film, it similarly tells the story of Curran and the hardships she faces.""Stupid is as stupid does"" is what Forrest Gump hears throughout his less than picturesque childhood. Though not as smart as the people he meets along the way, Forrest is thrust into some scary, crazy and downright incredible situations, rubbing shoulders with some great historical figures and escaping many dangers on sheer dumb luck. His giant heart and never fading love for his lifelong friend Jenny take him on a journey where he learns what his destiny is.A simple-minded but kind-hearted Alabama boy grows up with his best friend - a beautiful girl called Jenny. He succeeds in life through a mixture of luck and destiny and thus influences and is present at some of the most important events in the second half of the 20th century. Throughout his life he is told by other characters what life is about and whether it's all random or destined to happen, but he comes to his own conclusion towards the end.Slow-witted Forrest Gump has never thought of himself as disadvantaged, and thanks to his supportive mother, he leads anything but a restricted life. Whether dominating on the gridiron as a college football star, fighting in Vietnam or captaining a shrimp boat, Forrest inspires people with his childlike optimism. But one person Forrest cares about most may be the most difficult to save -- his childhood love, the sweet but troubled Jenny.The presidencies of Kennedy and Johnson, Vietnam, Watergate, and other history unfold through the perspective of an Alabama man with an IQ of 75.",PG-13
0106977,The Fugitive,"A well respected Chicago surgeon Dr. Richard Kimble has found out that his wife, Helen, has been murdered ferociously in her own home. The police found Kimble and accused him of the murder. Then, Kimble (without Justifiable Reason) was tried, convicted, and sentenced to death. However, on the way to prison, Kimble's transport crashed. Kimble escapes and is now on the run. Deputy Samuel Gerard from Chicago takes charge of the chase of Kimble. Meanwhile, Kimble takes up his own investigation to find who really killed his wife, and to lure Gerard and his team into it as well.Dr. Richard Kimble is a well-known surgeon based out of Chicago who returns home from work one night to find his wife Helen was murdered. The killer, a one-armed man, manages to escape before police arrive. With a lack of evidence pointing to the one-armed man, Kimble is arrested and charged with murder. On his way to prison, the bus he is in crashes, giving him the opportunity to escape. Kimble decides to find out who the real killer was and why his wife was murdered. Meanwhile, a US Marshal named Samuel Gerard and his team are tasked with finding Kimble and arresting him. However, the further he is to catching Kimble, the more Gerard is convinced he is innocent.Wrongfully accused of murdering his wife, Richard Kimble escapes from the law in an attempt to find her killer and clear his name. Pursuing him is a team of U.S. marshals led by Deputy Samuel Gerard, a determined detective who will not rest until Richard is captured. As Richard leads the team through a series of intricate chases, he discovers the secrets behind his wife's death and struggles to expose the killer before it is too late.Wrongly convicted of murdering his wife, Dr. Richard Kimble escapes from a prison bus and tries to find out why she was killed and who the murderer really was. He is relentlessly pursued by Samuel Gerard, a U.S. Marshal, and is forced to keep out of contact from any friends or relatives. However, his determination and ingenuity soon produce results and he comes to the frightening realisation that he can trust no one.Noted surgeon Richard Kimble is wrongfully accused, tried and convicted for the brutal murder of his wife. A failed escape attempt by other prisoners gives Kimble his opportunity to escape execution. The only option and purpose he has left is to discover who really murdered his wife and clear his name. On his trail is persistent US Marshal Samuel Gerard who slowly comes to believe that the original case might not be as clear cut as was first believed.Dr. Richard Kimble, unjustly accused of murdering his wife, must find the real killer while being the target of a nationwide manhunt lead by a seasoned US Marshall.",PG-13
2203939,The Other Woman,"After discovering her boyfriend is married, Carly Whitten tries to get her ruined life back on track. But when she accidentally meets the wife he's been cheating on, she realizes they have much in common, and her sworn enemy becomes her greatest friend. When yet another affair is discovered, all three women team up to plot mutual revenge on their cheating, lying, three-timing SOB.Kate is married to Mark and thinks he's a great guy. But in reality he's seeing another woman, Carly who doesn't know he's married. When he tells Kate he has to meet a client and won't come home when in reality he's planning to see Carly. But when Kate says she'll go join him. He tells her he'll cancel the meeting. So he tells Carly he has to take care of something at home. Carly then decides to go surprise him but runs into Kate and she freaks out and walks away. Kate later tracks Carly down and asks her if she and her husband are involved. She reluctantly admits it. And Kate has a breakdown of her own. They later get close and Kate is uncertain of what to do. When Mark comes on to her she thinks there's hope. But she overhears him talking to someone and she thinks it's Carly but she denies it. So they follow him and discover that he's seeing another girl and when they tell her about him, they decide to get back at him. But Kate is still unsure.In New York, the successful lawyer Carly Whitten is in love with her handsome boyfriend Mark King and she expects to introduce him to her father Frank. However Mark tells her that he needs to travel to his house in Connecticut since his housemaid has just reported a plumbing problem in the basement and he need to fix it. Carly decides to travel to meet him without previous notice and she finds that Mark is married with Kate King. Carly returns to New York and on the next morning, Kate visits her at her job to get information about her relationship with her husband. They conclude that he is a cheater and befriend each other. Soon they learn that Mark has a younger girlfriend, Amber, and they befriend her. The trio decides to team-up and plot revenge against Mark.Forty-something Carly Whitten is a high powered New York lawyer specializing in corporate acquisitions and mergers. When it comes to love and romance, she and her father Frank are two sides of a similar coinAfter discovering her boyfriend is married, Carly soon meets the wife he's been betraying. And when yet another love affair is discovered, all three women team up to plot revenge on the three-timing S.O.B.",PG-13
2283362,Jumanji: Welcome to the Jungle,"In a brand new Jumanji adventure, four high school kids discover an old video game console and are drawn into the game's jungle setting, literally becoming the adult avatars they chose. What they discover is that you don't just play Jumanji - you must survive it. To beat the game and return to the real world, they'll have to go on the most dangerous adventure of their lives, discover what Alan Parrish left 20 years ago, and change the way they think about themselves - or they'll be stuck in the game forever, to be played by others without break.Jumanji, the magical board game and the ancient portal to its fearsome and savage jungles, gets an upgrade, and this time, lures a motley crew of four high-school teenagers into its realm when one of them stumbles upon an old-school video game console. Inevitably, as the unwitting players transform into their chosen game avatars inside a mysterious new world crawling with formidable adversaries, they will have to put to good use their newly-acquired skills to finally complete the game. The deep sound of the feral tribal drums is incessant. Can the quirky quartet return to the physical world in one piece?When 4 high schoolers are sucked into the video game, jumanji, they soon find out that they each have special capabilities. They must use these capabilities to complete the challenges to escape jumanji, with a certain amount of lives and new bodies to handle, will these four teens band together to escape? Or will they be stuck in jumanji, forever!Four teenagers are sucked into a magical video game, and the only way they can escape is to work together to finish the game.",PG-13
0371746,Iron Man,"Tony Stark. Genius, billionaire, playboy, philanthropist. Son of legendary inventor and weapons contractor Howard Stark. When Tony Stark is assigned to give a weapons presentation to an Iraqi unit led by Lt. Col. James Rhodes, he's given a ride on enemy lines. That ride ends badly when Stark's Humvee that he's riding in is attacked by enemy combatants. He survives - barely - with a chest full of shrapnel and a car battery attached to his heart. In order to survive he comes up with a way to miniaturize the battery and figures out that the battery can power something else. Thus Iron Man is born. He uses the primitive device to escape from the cave in Iraq. Once back home, he then begins work on perfecting the Iron Man suit. But the man who was put in charge of Stark Industries has plans of his own to take over Tony's technology for other matters.After being kidnapped by a powerful terrorist organization, brilliant industrialist Tony Stark narrowly escapes using an iron suit he crafted from scrap metal and spare parts. Upon returning home, he devotes all of his time and resources to perfecting the iron man suit, and using it to fight evil, sometimes in the place where he least expects it.Billionaire, genius, playboy, philanthropist? All this and more sums up Tony Stark. After a weapons presentation in Iraq, Stark gets himself captured which also results in him having a chest filled with shrapnel. Needing to escape, he miniaturizes it and dons a suit of armor. This results in the birth of the Armored Avenger Iron Man. Once returned safely, Stark works to perfect his design and uses it to protect all mankind. This activity catches the eye of a mysterious organization known as SHIELD. On the other hand, the chairman of Stark Industries discovers this and has plans of his own for Tony's work.The playboy wolf and genius Tony Stark is the successful CIO of the Stark Industries, a weapon company founded by his father. His second in command is Obadiah Stane, who worked with his father, and his loyal and professional secretary is Pepper Potts, who has a crush on Tony. While in Afghanistan to demonstrate the ultimate Jericho missile developed by his company, his military convoy is attacked and Tony is seriously wounded on his chest and kidnapped by a group of rebels that wants him to assemble a missile for their use. Tony stays with his abductors for three months and develops a powerful metallic armor to escape from the cave where he is arrested. He decides to stop manufacturing weapons in his company under the protest of Obadiah, and dedicates his time to improve the armor, manufacturing it with gold and titanium and installing a propulsion system to fly. However, Pepper discovers that Tony was betrayed by Obadiah, who is using Tony's data to build prototype armor for him, transforming it in the ultimate weapon.After being held captive in an Afghan cave, billionaire engineer Tony Stark creates a unique weaponized suit of armor to fight evil.",PG-13
1843866,Captain America: The Winter Soldier,"For Steve Rogers, awakening after decades of suspended animation involves more than catching up on pop culture; it also means that this old school idealist must face a world of subtler threats and difficult moral complexities. That becomes clear when Director Nick Fury is killed by the mysterious assassin, the Winter Soldier, but not before warning Rogers that SHIELD has been subverted by its enemies. When Rogers acts on Fury's warning to trust no one there, he is branded as a traitor by the organization. Now a fugitive, Captain America must get to the bottom of this deadly mystery with the help of the Black Widow and his new friend, The Falcon. However, the battle will be costly for the Sentinel of Liberty, with Rogers finding enemies where he least expects them while learning that the Winter Soldier looks disturbingly familiar.Steve Rogers is coming to grips with living in modern America after being frozen in ice for 50 years. A new threat against S.H.I.E.L.D. arises called ""The Winter Soldier"". While the origins of the Winter Soldier are unknown, the threat against S.H.I.E.L.D. from the Hydra organization is. Especially after it compromises Nick Fury and Agent Romanoff, leaving them betrayed and left for dead, and their S.H.I.E.L.D. status revoked, marking them as traitors to the organization. Now racing against time with very little resources available at his disposal, Captain America launches an investigation into S.H.I.E.L.D.'s origins and that has him returning to the very Army base where he once underwent basic training nearly 100 years ago. What he and Romanoff discover there leads to a very startling development with S.H.I.E.L.D., a top secret project called ""Operation Insight"", and the launch of the next generation of Helicarrier. Can they stop it before it's too late?After commanding a successful rescuing mission of hostages from pirates in a ship, Steve Rogers meets Nick Fury very upset since Natasha Romanoff had different objectives from his. Nick explains that he does not trust anybody but discloses the latest top secret project from SHIELD called ""Operation Insight"" that will launch three aircraft carriers into space, linked by a satellite to protect the world. There is an attempt against Nick by the Winter Soldier and Nick goes to Steve's apartment and delivers a flash memory to Steve. He tells that SHIELD is compromised with infiltrated HYDRA agents; then Nick is badly wounded by three shots and goes on surgery. Secretary Alexander Pierce asks Steve why Nick was in his apartment but he refuses to tell. Soon Steve is considered traitor and hunted down by the SHIELD agents and he teams up with Natasha and Sam ""Falcon ""Wilson. Now they investigate the reason why Nick was chased and they discover a lethal secret plotted by the HYDRA.Steve Rogers, finding it easier to acclimate to the modern society as a soldier of SHIELD, learns that the organization has been compromised and a Soviet assassin known as The Winter Soldier will stop at nothing to kill Captain America, which leads him uncover a truth that will change everything.Two years after the alien attack on New York, Steve Rogers starts to adjust to the modern world and works as an agent of SHIELD. However, Steve disagrees with the rules of today as he faces a world of threats and complexities. When Director Nick Fury is killed by a mysterious assassin called the Winter Soldier, Steve is warned not to trust anyone, only to find himself being framed for not sharing information. On the run, Rogers launches an investigation into a deadly conspiracy which reveals that SHIELD has been infiltrated by his old arch nemesis HYDRA, who have been hiding in plain sight. With only Black Widow and Falcon as backup, Rogers must once again suit up and defeat HYDRA from launching their ultimate weapon before it's too late.As Steve Rogers struggles to embrace his role in the modern world, he teams up with a fellow Avenger and S.H.I.E.L.D agent, Black Widow, to battle a new threat from history",PG-13
5690360,Slender Man,"In a small town in Massachusetts, a group of friends, fascinated by the internet lore of the Slender Man, attempt to prove that he doesn't actually exist - until one of them mysteriously goes missing.",PG-13
1343092,The Great Gatsby,"An adaptation of F. Scott Fitzgerald's Long Island-set novel, where Midwesterner Nick Carraway is lured into the lavish world of his neighbor, Jay Gatsby. Soon enough, however, Carraway will see through the cracks of Gatsby's nouveau riche existence, where obsession, madness, and tragedy await.New York,1929. Bond-seller Nick Carraway, in a sanitarium for depression and alcoholism, is persuaded by his doctor to write a therapeutic account of what put him there. Nick's journal describes how, seven years earlier, he had moved to a tiny house on Long Island adjoining the sumptuous mansion owned by enigmatic neighbour, the fabulously wealthy Jay Gatsby. After attending one of Gatsby's legendary parties Nick is asked by Gatsby to arrange a meeting with his cousin, Daisy, now married to the brutish and philandering Tom Buchanan, who was Gatsby's true love, prior to war service. As Nick complies he comes to see that Gatsby, once a poor boy, has recreated himself as a fascinating millionaire purely to win Daisy back but the events of a drunken afternoon conspire to bring about an ending which is anything but happy.Midwest native Nick Carraway arrives in 1922 New York in search of the American dream. Nick, a would-be writer, moves in next-door to millionaire Jay Gatsby and across the bay from his cousin Daisy and her philandering husband, Tom (Joel Edgerton). Thus, Nick becomes drawn into the captivating world of the wealthy and -- as he bears witness to their illusions and deceits -- pens a tale of impossible love, dreams, and tragedy.A writer and wall street trader, Nick, finds himself drawn to the past and lifestyle of his millionaire neighbor, Jay Gatsby.",PG-13
