id,title,plot,mpaa
0213203,Rugrats in Paris: The Movie,"Wishes come true in Rugrats in Paris The Movie, and love makes its way into the hearts of those young, old and overseas. Chuckie's dad, Chazz, starts dating again, and it's Chuckie's wish to find a new mom. When Stu Pickles is summoned to Reptarland, an amazing new amusement park in Paris, to work on his Reptar invention, Tommy, Chuckie, Angelica, Phil, Lil, Dil, Didi and the whole gang tag along to the city of romance. But the Rugrats' big adventure turns out to be more than glamour, fashion and smelly cheese. Chuckie learns that when it comes to princesses and potential mommies, things are not always what they seem, and for Chazz, finding the right woman can be difficult in any language. As the Rugrats' travels take them from the Eiffel Tower to Notre Dame and everywhere in between, the world's favorite babies learn new lessons about courage, loyalty, trust and above all, true love.The Rugrats are back! There's Tommy the brave one, Chuckie the timid one, Phil and Lil the odd couple, Dil, and spoiled brat Angelica. This time they're wreaking havoc in Paris, France, where Tommy's dad Stu is summoned after yet another one of his inventions took a dump. Chuckie's Pop, Chas, is looking to date again, it's been years since the passing of his previous wife, also a new mommy for Chuckie would be in order. He comes to the conclusion of three candidatesThe Rugrats travel to Paris, France, where Chuckie hopes to find a new mother and keep his father from marrying an evil business woman.",G
0065421,The Aristocats,"Retired madame Adelaide Bonfamille enjoys the good life in her Paris villa with even classier cat Duchess and three kittensThe beloved, pampered housecat of a retired opera star in 1910 Paris finds herself stranded in the countryside with her three children, the victims of a plot by their owner's butler to cheat them out of a huge inheritance. They must find their way back to their home and owner, with the help of an independent-minded tomcat and other animal accomplices, while evading the butler and foiling his plan.With the help of a smooth talking tomcat, a family of Parisian felines set to inherit a fortune from their owner try to make it back home after a jealous butler kidnaps them and leaves them in the country.",G
0070438,The Neptune Factor,"Aboard the R/V Triton, the Project Neptune team is doing oceanographic research. Director Andrews is trying to keep the research going in spite of opposition from Foundation Head Sheppard. Below on the ocean floor, in the Sealab, the team led by Hamilton is about to return to the surface when the Sealab is ripped loose from it's moorings and sent careening into a trench. Trapped too deep for divers, the only chance is rescue by a new US Navy mini-sub, piloted by the arrogant Cdr Blake USN. Blake, Chief Diver MacKay, Diver Cousins & Dr. Jansen (Hamilton's fiance) dive in the mini sub to attempt the rescue of the trapped Hamilton & crew.When an underwater ocean lab is lost in a earthquake, an advanced submarine is sent down to find it and encounters terrible danger.",G
0451079,Horton Hears a Who!,"One day, Horton the elephant hears a cry from help coming from a speck of dust. Even though he can't see anyone on the speck, he decides to help it. As it turns out, the speck of dust is home to the Whos, who live in their city of Whoville. Horton agrees to help protect the Whos and their home, but this gives him nothing but torment from his neighbors, who refuse to believe that anything could survive on the speck. Still, Horton stands by the motto that, ""After all, a person is a person, no matter how small.""While living in the Jungle of Nool, friendly elephant Horton enjoys living life while teaching school to the animal children. But when he hears a voice coming from a tiny speck of dust, he discovers that it is actually the microscopic town of Whoville. Wanting to keep it safe, Horton swears to help his new tiny friends and get them to safety. But Horton must watch out for a sneaky kangaroo who is out to prove that Horton is crazy and that he is threatening the safety of the children.In the jungle of Nool, the elephant Horton hears a voice in a speck; he uses a clover to rescue the speck of dust and he makes contact with the Mayor of Whoville. Horton discovers that in that tiny speck there is a city crowded with creatures and he decides to leave Whoville in a safe place. However, the evil Kangaroo does not believe Horton's story and thinks he's dangerous for the children of Nool, making them believe in what they cannot see, hear, or feel, and incites the animals against Horton.Horton the Elephant struggles to protect a microscopic community from his neighbors who refuse to believe it exists.",G
0108071,The Secret Garden,"Living in India, Mary Lennox, a young, privileged girl, is left orphaned when her parents are killed in an earthquake. She is sent back to England where she goes to live on her uncle's estate. It is a fairly isolated existence and she has to find things to keep herself occupied. She finds a sickly young boy...and a secret garden.A young British girl born and raised in India loses her neglectful parents in an earthquake. She is returned to England to live at her uncle's estate. Her uncle is very distant due to the loss of his wife ten years before. Neglected once again, she begins exploring the estate and discovers a garden that has been locked and neglected. Aided by one of the servants' brothers, she begins restoring the garden, and eventually discovers some other secrets of the manor.Young Mary Lennox is orphaned by an earthquake in India and sent to England to live with her uncle in a cold ancestral manor in Yorkshire. Mary briefly meets him, still mourning for his wife who died ten years ago, but she is mostly left on her own. A resourceful and inquisitive girl, she soon makes two exciting discoveries. First she finds an overgrown secret garden, the favorite of her aunt and locked up since her death. Second, that she has a cousin, Colin, a sickly boy who has been told he must remain in bed out of the daylight at all times. Once Mary and another new friend, Dickon, have brought the garden back to life they decide Colin must see it, a decision that will change several lives.After losing her self-indulging parents in an earthquake, a bitter young girl named Mary Lennox is sent to live in England with her reclusive uncle. Eventually she discovers her bedridden cousin and a 'secret garden' that once belonged to her deceased aunt. With the help of her cousin, the kindly Dickon, and a little 'magic', can Mary find a way to bring love back to her family?A young, recently-orphaned girl is sent to England after living in India all her life. Once there, she begins to explore her new, seemingly-isolated surroundings -- and its secrets.",G
0396652,Ice Princess,"A high-school bookworm transforms into a swan. Brainy Casey Carlyle has never quite fit in. Caught between her fantasy of becoming a championship figure skater and her strong-willed mother, who has her on the fast track to Harvard, she can only hope to be like Nikki, Tiffany and Gen--three elite skating prodigies who are ruthlessly competing on the US National circuit (and have attitudes to match). But when Casey gets the chance to train with Gen and her coach, a disgraced former skating champion who also happens to be Gen's mother, she must dash her own mother's hopes in order to pursue her dream. Now, with only the support of Gen's teenage brother, a hunky Zamboni driver, Casey takes on the challenge of her life when she finds herself competing against the best to make it into the championship circuit and become a real ""ice princess.""17-year-old physics whiz Casey Carlyle is urged by her physics teacher to work on a physics project over the summer for presentation to Harvard. As a skater, Casey decides on a project that shows the elements of physics applied in competitive figure skating. To start, she visits a skating club run by former professional skater Tina Harwood. Casey eventually finds that in order to better understand the principles she's using, she will have to become her own test subject, and joins the skating school. The more she gets involved, the more she falls in love with figure skating....and must ultimately make a choice; Will it be Harvard - which her mother and Casey have both dreamed of, or will it be her new dream - as a competitive figure skater?With the help of her coach, her mom, and the boy who drives the Zamboni machine, nothing can stop Casey (Trachtenberg) from realizing her dream to be a champion figure skater.",G
8179218,Alex & Me,"Teenager Reagan Willis (Agudong) has one dream -- to play soccer like her hero, Alex Morgan. Her bedroom is a shrine to all things Alex, including a life-size poster of the Olympic gold medalist. Yet in the Willis house, Reagan lives in the shadow of her prep football superstar brother, Logan. When Reagan fails to make the cut of the premiere local soccer club team and is humiliated by her rival Claire, she's certain her ship has sailed. But after accidentally hitting her head, Reagan's poster of Alex Morgan suddenly comes to life and everything changes.Alex and Me is an uplifting story of the passion and drive it takes to succeed and the power of family to help realize your dreams.",G
0092603,Babette's Feast,"In a remote 19th-century Danish village, two sisters lead a rigid life centered around their father, the local minister, and their church. Both had opportunities to leave the villageDenmark, 1870s. Two deeply religious elderly sisters living in an isolated village take in a French refugee from the Franco-Prussian war, Babette. She becomes their housekeeper and is happy to work for no pay. 14 years later, Babette wins a large amount of money in a lottery. The event coincides with the 100th anniversary of the birth of the sisters' father, a devout Christian minister who had a great following in the village. Babette decides to throw a great dinner for the the remaining followers to honour the occasion. One thingIn 19th century Denmark, two adult sisters live in an isolated village with their father, who is the honored pastor of a small Protestant church that is almost a sect unto itself. Although they each are presented with a real opportunity to leave the village, the sisters choose to stay with their father, to serve to him and their church. After some years, a French woman refugee, Babette, arrives at their door, begs them to take her in, and commits herself to work for them as maid/housekeeper/cook. Sometime after their father dies, the sisters decide to hold a dinner to commemorate the 100th anniversary of his birth. Babette experiences unexpected good fortune and implores the sisters to allow her to take charge of the preparation of the meal. Although they are secretly concerned about what Babette, a Catholic and a foreigner, might do, the sisters allow her to go ahead. Babette then prepares the feast of a lifetime for the members of the tiny church and an important gentleman related to one of them.During the late 19th century, a strict religious community in a Danish village takes in a French refugee from the Franco-Prussian War as a servant to the late pastor's daughters.",G
0097757,The Little Mermaid,"In Disney's beguiling animated romp, rebellious 16-year-old mermaid Ariel is fascinated with life on land. On one of her visits to the surface, which are forbidden by her controlling father, King Triton, she falls for a human prince. Determined to be with her new love, Ariel makes a dangerous deal with the sea witch Ursula to become human for three days. But when plans go awry for the star-crossed lovers, the king must make the ultimate sacrifice for his daughter.Loosely based upon the story by Hans Christian Andersen. Ariel, youngest daughter of King Triton, is dissatisfied with life in the sea. She longs to be with the humans above the surface, and is often caught in arguments with her father over those ""barbaric fish-eaters"". She goes to meet Ursula, the Sea Witch, to strike a deal, but Ursula has bigger plans for this mermaid and her father.This is the story of a little mermaid named Ariel, who dreams of going on land. When her father, King Triton, forbids her to go on land, Ariel visits Ursula who her father had banished. Even though she helps her get to land, what Ariel doesn't know is that Ursula has plans to destroy her to get revenge on her father.A mermaid princess makes a Faustian bargain with an unscrupulous sea-witch in order to meet a human prince on land.",G
0283426,The Jungle Book 2,"Jungle boy Mowgli (voiced by Osment) decides to forsake civilized village life for the ""bare necessities"" of the wild with his old friends. However, the evil tiger Shere Khan is looking for a little payback after Mowgli's last adventure. Trouble's a-brewing!Mowgli feels out of place in his new home, despite the efforts of his friend Shanti and his new little brother. So when Baloo arrives for a visit, the man-cub takes the opportunity to return for some fun in the jungle. However, Shanti, believing her friend was taken, follows them. With Shere Khan still on the hunt for him, Mowgli must protect himself and the ones he cares about from the dangers ahead. The new adventures make him reconsider his decisions and decide which he wants more - a life of laid back hilarity with Baloo in the jungle or a simpler existance in the man village with Shanti.Mowgli, missing the jungle and his old friends, runs away from the man village unaware of the danger he's in by going back to the wild.",G
0113824,Whisper of the Heart,"A young Japanese middle school girl finds that all the books she chooses in the library have been previously checked out by the same boy. Later she meets a very infuriating fellow... could it be her ""friend"" from the library? The boy's grandfather has a violin sales and service shop. The boy wants to be a violin maker like his grandfather.14-year-old teenage bookworm Shizuku lives a simple life, dominated by her love for stories and writing. One day she notices that all the library books she has have been previously checked out by the same personA love story between a girl who loves reading books, and a boy who has previously checked out all of the library books she chooses.",G
0066473,Tora! Tora! Tora!,"This dramatic retelling of the Pearl Harbor attack details everything in the days that led up to that tragic moment in American history. As United States and Japanese relations strain over the U.S. embargo of raw materials, Air Staff Officer Minoru Genda (Tatsuya Mihashi) plans the preemptive strike against the United States. Although American intelligence agencies intercept Japanese communications hinting at the attack, they are unwilling to believe such a strike could ever occur on U.S. soil.In 1941 the Japanese are at odds with the United States on a number of issues which they are attempting to resolve via their Washington embassy. In case this diplomacy fails, the military are hatching plans for a surprise early Sunday morning air attack on the U.S. base at Pearl Harbour. American intelligence is breaking the Japanese diplomatic messages but few high-ups are prepared to believe that an attack is likely, let alone where or how it might come.The path to war in December 1941 is retold from the appointment of Isoroku Yamamoto to command the Imperial Japanese Navy on through the execution of his most ambitious and audacious plan - an attack by carrier aircraft on the US Navy station at Pearl Harbor, in Hawaii. As the Japanese First Air Fleet sorties to Hawaii, diplomatic efforts by both nations continue, but intercepts of Japanese diplomatic messages show Japan is practicing deception and planning aggression - but there is no clue as to where Japan will strike.In the summer of 1941, the United States and Japan seem on the brink of war after constant embargos and failed diplomacy come to no end. ""Tora! Tora! Tora!"", named after the code words use by the lead Japanese pilot to indicate they had surprised the Americans, covers the days leading up to the attack on Pearl Harbor, which plunged America into the Second World War.In 1941, following months of economic embargo, Japan prepares to open its war against the United States with a preventive strike on the US naval base at Pearl Harbor.",G
0117110,Muppet Treasure Island,"The Muppets are back into action in another movie based on a novel written by Robert Louis Stevenson. Kermit the Frog and his colleagues go on a warfare against ruthless pirates. They also share their problem-solving journey on sea to rescue a treasure.The Muppets are back in action as they sail the high seas in their own twist of the classic tale by Robert Louis Stevenson. Having heard the legend of Captain Flint's massive treasure, young cabin boy Jim Hawkins along with Gonzo and Rizzo set out on a frantic search for it on a mysterious island. Accompanied by Squire Trelawney and Capt. Smollett, Jim and his friends finally get their own taste of adventure. But they soon uncover a sinister plot by a band of villainous pirates who seek the treasure for their own led by the ship's devious cook Long John Silver. Once on the island, they find it is full of danger including an inhabitant named Benjamina Gunn.After telling the story of Flint's last journey to young Jim Hawkins, Billy Bones has a heart attack and dies just as Jim and his friends are attacked by pirates. The gang escapes into the town where they convince Squire Trelawney to hire out a boat and crew to find the hidden treasure, which was revealed by Bones before he died. On their voyage across the seas, they soon find out that not everyone on board can be trusted.The Muppets' twist on the classic tale.",G
0120762,Mulan,"This retelling of the old Chinese folktale is about the story of a young Chinese maiden who learns that her weakened and lame father is to be called up into the army in order to fight the invading Huns. Knowing that he would never survive the rigours of war in his state, she decides to disguise herself and join in his place. Unknown to her, her ancestors are aware of this and to prevent it, they order a tiny disgraced dragon, Mushu to join her in order to force her to abandon her plan. He agrees, but when he meets Mulan, he learns that she cannot be dissuaded and so decides to help her in the perilous times ahead.Mulan is a girl, the only child of her honored family. When the Huns invade China, one man from every family is called to arms. Mulan's father, who has an old wound and cannot walk properly, decides to fight for his country and the honor of his family though it is clear that he will not survive an enemy encounter. Mulan, who just got rejected by the matchmaker because she had set her on fire, decides to prove that she is worth something and steals away to fit her father's place in the Chinese army. She prays to her family's ancestors for protection and luck before leaving as a man in her father's armor with her family's horse. The ancestors awake and decide to send Mushu, a little dishonored dragon to aid Mulan in her quest. Weeks later, Mulan and the other troopers have survived the training camp and are on the way north to stop the Huns. After being spotted and pursued by the enemies, an impass situation in the mountains forces Mulan to come up with an idea. But then, her real gender will no longer be a secret. She decides to risk everything in order to save China.The Fa family's only child, tomboy Mulan, fails to fulfill a Chinese girl's traditional duty as desirable bride. When the empire mobilizes a man from every family to fight the invading Huns, Mulan fears her father, an honorable veteran, is no longer up to fighting and joins in his place, masquerading as fictitious son Fa Ping. The ancestors designate the mighty stone dragon as her magical protector, but only eager baby-dragon Mushu actually goes. Ping is assigned to general Li son captain Fa Li's training unit. He does an amazing job preparing the peasant recruits, yet only Mushu and the luck cricket grandma gave Mulan overturn the mandarin adviser's negative report. When the reach the front, the Huns have already wiped out the regular army. Now the novice company must save China or perish honorably.To save her father from death in the army, a young maiden secretly goes in his place and becomes one of China's greatest heroines in the process.",G
0056262,The Music Man,"It's the early twentieth century American Midwest. A con man currently going by the assumed name Harold Hill has used several different schemes to bilk the unsuspecting, and now travels from town to town pretending to be a professor of music - from Gary (Indiana) Conservatory of Music, class of '05 - who solves all the respective towns' youth problems by forming boys' marching bands. He takes money from the townsfolk to buy instruments, music, instructional materials, and uniforms for their sons. However, in reality he has no degree and knows nothing about music, and after all the materials arrive and are distributed, he absconds with all the money, never to be seen again. Many of the traveling salesmen in the territory have been negatively impacted by him, as the townsfolk then become suspicious of any stranger trying to sell them something. For Harold's scheme to work, he must gain the trust of the local music teacher, usually by wooing her, regardless of her appearance. And if the town doesn't believe it has a youth problem needing to be fixed, he will manufacture one for them. That is the case when he arrives in River City, Iowa, population 2,212, where he will have some unexpected help from Marcellus Washburn, a friend and former grifter colleague who now lives in River City and has gone straight, but still wants to make sure Harold survives his stay in town. River City's music teacher is spinster and town librarian Marian Paroo. He's able to impress all the other River Citizens with his fast-talking sales pitches, but not suspicious Marian, whose hard-as-nails exterior The music teacher he has to impress in River City is spinster Marian Paroo, who is also the town librarian. Unlike all the other River Citizens who he is able to impress with his fast talking sales pitches, he is unable to impress suspicious Marian, whose hard-as-nail exterior is partly due to her somewhat removed standing in the town, as all the gossipy housewives believe she is a smut peddler - encouraging the teenagers to read authors such as Chaucer and Balzac - and mistakenly believe she got her position as librarian through less-than-scrupulous means. What Harold does not know is that one way to Marian is through her young adolescent brother, Winthrop Paroo, a sullen boy who has withdrawn from life since their father's death two years before, when he started to lisp. Harold starts to fall for Marian, something that never happened with any of the other music teachers. Further complications may ensue if any of those traveling salesmen who have been following his route through the territory catch up with and expose him.When traveling con man Harold Hill arrives in River City, he convinces the locals to start a band by purchasing the uniforms and instruments from him. He intends to flee as soon as he receives the money. Librarian Marian Paroo suspects that he's a fraud, but since her moody brother Winthrop is excited about the band, she keeps silent. As Harold develops feelings for Marian, he faces a difficult decision about skipping town.Confidence man Harold Hill arrives at staid River City intending to cheat the community with his standard scam of offering to equip and train a boys' marching band, then skip town with the money since he has no music knowledge or skill. Things go awry when he falls for a librarian he tries to divert from exposing him while he inadvertently enriches the town with a love of music.Professor Harold Hill likes a challenge and when the other salesmen on the train west tell him that Iowa is the biggest test of all of sales ability, he gets off at River City. We know it's the 20th century there, only because of a reference in one of the songs to Gary, Indiana. Marian the librarian doesn't buy the professor's line but he convinces many of his other potential customers that the new pool table that has just been placed in the billiard parlor could mean ""trouble in River City."" How to keep the youngsters ""moral after school?"" Form a boys' marching band.Classic of flag-waving, feel-good, musical comedic Americana, based on a hit Broadway show, with a refreshingly jaundiced subtextHarold Hill poses as a boys' band leader to con naive Iowa townsfolk.",G
0067065,Escape from the Planet of the Apes,"Following the events in ""Beneath the Planet of the Apes"", Cornelius and Zira flee back through time to 20th Century Los Angeles, where they face fear and persecution similar to what Taylor and Brent suffered in the future, and discover the origins of the stream of events that will shape their world.Cornelius and Zira, the simian ape couple from the first two ape films, flee from their doomed planet (after the events in Beneath...) in the same spaceship used by Taylor in the first film, and travel back through the same space/time porthole and land on late 20th Century Earth where they are received with fascination and fear from the people they meet.The third chapter of the Apes saga. Two intelligent simians from the future, Cornelius and Zira, travel to present-day Earth. They become instant sensations, wined and dined and treated like celebrities -- until a high-level plot forces them to run for their lives.The world is shocked by the appearance of three talking chimpanzees, who arrived mysteriously in a U.S. spacecraft. They become the toast of society, but one man believes them to be a threat to the human race.",G
