id,title,plot,mpaa
0057129,The Haunting,"Dr. Markway, doing research to prove the existence of ghosts, investigates Hill House, a large, eerie mansion with a lurid history of violent death and insanity. With him are the skeptical young Luke, who stands to inherit the house, the mysterious and clairvoyant Theodora and the insecure Eleanor, whose psychic abilities make her feel somehow attuned to whatever spirits inhabit the old mansion. As time goes by it becomes obvious that they have gotten more than they bargained for as the ghostly presence in the house manifests itself in horrific and deadly ways.Located in a remote part of New England and isolated from any nearby community, Hill House is a 90-year-old, 19th century mansion with a long history of death and murder. When Dr. John Markway gets a chance to stay there for a few weeks, he sees an opportunity to study what is reportedly a genuine haunted house. With several others including Luke Sanderson, Eleanor 'Nell' Lance and a one-named woman named Theodora, they prepare to launch their experiments. Theo is there because of her ESP skills while Nell had a previous experience with a poltergeist and Luke represents the family that still owns Hill House. Soon after their arrival, the temporary occupants begin to face terrifying ordeals. Nell, who has lived a sheltered and repressed life having spent all of her time caring for her recently deceased mother, is clearly the focus of the emanations and the haunting. She is both terrified and comforted in Hill House and part of her wants to stay. The spirits seem to want to keep her as well.Ninety years ago, Hugh Crain builds the mansion Hill House in a remote area of New England. When his wife is moving to the mansion, she has an accident and dies, leaving the bitter Hugh Crain and his daughter Abigail alone in Hill House. Hugh Crain marries again and his new wife also dies in Hill House. He moves to England and dies, leaving Abigail alone. When she is an old and invalid woman, she hires a paid companion from the village, but the woman neglects her and she dies. The companion inherits Hill House but the mansion drives her crazy and she commits suicide. In the present days (1963), Dr. John Markway rents the mansion from the inheritor Mrs. Sanderson to study the supernatural and prove the existence of ghosts. He invites the clairvoyant Theodora 'Theo' and the unbalanced and needy psychic Eleanor 'Nell' Lance to spend vacation in Hill House, and he goes with the skeptical future inheritor Luke Sanderson to the mansion. During the nights, the quartet witness supernatural manifestation in the house and the sanity of Nell is affected by her ghosts.Anthropologist Dr. John Markway is interested in the study of the supernatural, much to the chagrin of his wife, Grace Markway. He is able to convince Mrs. Sanderson, the current owner of isolated Hill House, to let him bring a research team into the house to search for supernatural phenomena. In its ninety year history, Hill House, located in remote New England, has been the location of many a violent and mysterious death of its inhabitants, Mrs. Sanderson being a distant relative of the original family owners, the Crains. Mrs. Sanderson, who doesn't live at the house believing it to be haunted, has one stipulationProfessor of psychic phenomenon, Dr. John Markway, upon doing research to prove the existence of ghosts secures a short-term rental agreement for the vast estate of the infamous, Hill House. Tucked far away in a remote region of New England, Hill House includes a disturbing, lurid history of violent death and tragic insanity. Investigating with him, the confident, skeptical, twenty-something Luke, who stands to inherit the house, in addition to the beautiful, guarded clairvoyant, Theodora and the nervous, insecure, spinster Eleanor. Simultaneously terrified & intoxicated by Hill House, timid Eleanor, whose long-ago, mysterious psychic incident, might somehow be linking her as an spirit-world divining rod, attuned to whatever might be inhabiting this, seeming endless, laberyth mansion. As time goes by and situations begin to stack up, it becomes obvious that these four individuals have gotten themselves into something far more than they bargained for. Tensions mount, so then the ghostly presence of the house, which the ways horrific and the deadly manifest into The Haunting.A scientist doing research on the paranormal invites two women to a haunted mansion. One of the participants soon starts losing her mind.",G
0435761,Toy Story 3,"Woody, Buzz and the whole gang are back. As their owner Andy prepares to depart for college, his loyal toys find themselves in daycare where untamed tots with their sticky little fingers do not play nice. So, it's all for one and one for all as they join Barbie's counterpart Ken, a thespian hedgehog named Mr. Pricklepants and a pink, strawberry-scented teddy bear called Lots-o'-Huggin' Bear to plan their great escape.With their beloved Andy preparing to leave for college, Woody, Buzz Lightyear, Jessie, and the rest of the toys find themselves headed for the attic but mistakenly wind up on the curb with the trash. Woody's quick thinking saves the gang, but all but Woody end up being donated to a day-care center. Unfortunately, the uncontrollable kids do not play nice, so Woody and the gang make plans for a great escape.As their owner Andy begins preparing for college, Woody, Buzz and their friends feel like they need to move on as well. The toys are then mistakenly sent to a local daycare center with the intention to be played with again. But their enthusiasm is short lived when they discover the true nature of their new home which is run by the dictatorship of an evil bear named Lotso. Now it's up to Woody to rescue his friends and plan a daring escape in order to returning home before Andy is gone forever.Andy is going to college and doesn't play with his toys anymore causing Woody and the others to be donated to Sunnyside Daycare, where they discover that the place is not exactly what they dreamed it was, and will have to face many dangers to come home safely.Andy is now 17 and ready to head off to college, leaving Woody, Buzz, Jessie, and the rest of the toy-box gang to ponder their uncertain futures. When the toys are accidentally donated to the Sunnyside Daycare center they're initially overjoyed to once again be played with, but their enthusiasm quickly gives way to horror as they discover the true nature of the establishment under the rule of the deceptively welcoming ""Lotso"" Bear. Now, all of the toys must band together in one final, crazy scheme to escape their confines and return home to Andy.The toys are mistakenly delivered to a day-care center instead of the attic right before Andy leaves for college, and it's up to Woody to convince the other toys that they weren't abandoned and to return home.",G
0338348,The Polar Express,"This is the story of a young hero boy on Christmas Eve who boards on a powerful magical train that's headed to the North Pole and Santa Claus's home. What unfolds is an adventure which follows a doubting boy, who takes an extraordinary train ride to the North Pole; during this ride, he embarks on a journey of self-discovery which shows him that the wonder of life never fades for those who believe.Wrestling with burgeoning doubts on the ever-present question over Santa Claus' existence, the sceptical youngster, Hero Boy, hears the familiar sound of a locomotive which interrupts his already troubled sleep. And then, much to his surprise, a cryptic conductor invites him to board the magnificent Polar Express on an unforgettable and magical adventure all the way up to the frozen landscapes of the vast North Pole, Santa's realm. Will Hero Boy and the rest of the young non-believers aboard the iron steam engine finally find the true spirit of Christmas?Santa Claus does not exist. Or does he? For one doubting boy, an astonishing event occurs. Late on Christmas Eve night, he lies in bed hoping to hear the sound of reindeer bells from Santa's sleigh. When to his surprise, a steam engine's roar and whistle can be heard outside his window. The conductor invites him on board to take an extraordinary journey to the North Pole with many other pajama-clad children. There, he receives an extraordinary gift only those who still believe in Santa can experience.On Christmas Eve, a young boy embarks on a magical adventure to the North Pole on the Polar Express, while learning about friendship, bravery, and the spirit of Christmas.",G
0076363,The Many Adventures of Winnie the Pooh,"Pooh, a bear of very little brain, and all his friends in the Hundred Acre Wood sing their way through adventures that encompass honey, bees, bouncing, balloons, Eeyore's birthday, floods, and Pooh sticks.A collection of animated shorts based on the stories and characters by A. A. Milne.",G
0047472,Seven Brides for Seven Brothers,"Adam, the eldest of seven brothers, goes to town to get a wife. He convinces Milly to marry him that same day. They return to his backwoods home. Only then does she discover he has six brothers - all living in his cabin. Milly sets out to reform the uncouth siblings, who are anxious to get wives of their own. Then, after reading about the Roman capture of the Sabine women, Adam develops an inspired solution to his brothers' loneliness.In 1850, in the Oregon Territory, the provincial farmer Adam Pontipee comes to the town to trade supplies and find a wife. When he meets the strong hard worker Milly working in a bar, he proposes her. Milly has a crush on Adam and marries him, expecting to have her own place with her husband. However, when they arrive in the distant farm, she leans that Adam is the eldest of seven unsophisticated and rude brothers. Milly educates the brothers, teaching them hygiene, good manners and how to win somebody's heart. In the annual town picnic, Milly, Adam and his six brothers go to the party and each of his brothers fall in love for a girl. However, they have to return to the loneliness of their farm. In the winter, Adam reads Plutarch and tells his brothers about ""The Rape of the Sabine Women"", when the Roman men had abducted wives for themselves from the Sabine families. He travels with his brothers to the town and they kidnap their beloved girls. When they cross a gorge, they provoke a snow avalanche and block the narrow passage. However, Milly keeps the girls in the house and sends Adam and his brothers to the barn. But until the spring, when the passage will be open again, many things happen in the farm with Milly, Adam, his brothers and their ""brides"".On one of his few trips into town per year, backwoodsman Adam Pontipee has a larger shopping list than usual. On his shopping list this time is a wife, not only a beautiful woman, but one that can cook and clean and transform his pigsty of a farm into a real home. Against the odds, he does find one in the form of Millie, the headstrong cook at the local inn. For her, it's love at first sight. Upon arriving at Adam's farm in the Oregon mountains, Millie finds her new lot in life is not only as loving wife, but housemaid to Adam's six brothers, who all live at the farm. The Pontipee's are rough and tumble and ill mannered as they haven't been exposed to much in life outside their remote farm. Adam's new life and a trip into town themselves inspires the six brothers to find wives of their own. Adam and Millie each have differing views on how best to achieve the brothers' collective wish. As the six unmarried brothers strive to achieve their goal, Adam may lose his in taking his wife for granted.In 1850 Oregon, when a backwoodsman brings a wife home to his farm, his six brothers decide that they want to get married too.",G
0060754,The Night of the Grizzly,"Marshal ""Big Jim"" Cole turns in his badge and heads to Wyoming with his family in order to settle on some land left him by a relative. He faces opposition from a neighbor who wants that land for his own sons, and from a grizzly bear, nicknamed ""Satan"", who keeps killing Cole's livestock.Ex-lawman Jim Cole retires to Wyoming to farm his land, but a land-greedy neighbor, an ex-con turned bounty hunter, and a vicious grizzly bear upset his retirement plans.",G
0052722,Darby O'Gill and the Little People,"Darby O'Gill seems to be as full of blarney as any old codger in Ireland, but the stories of leprechauns he tells at the pub are true. In fact, he and the tiny King Brian, ruler of the little people, are friendly adversaries, continually out-foxing each other. Darby needs a bit of magical help from the wily king when Lord Fitzpatrick replaces him as caretaker with the handsome, strapping young Michael from Dublin. Michael falls in love with Darby's beautiful daughter, Katie, which is all right with Darby; but the lad has a rival in a local ruffian, the son of a devious widow who wants her boy to be the caretaker. King Brian's supernatural assistance is necessary to make everything come out all right, but the sneaky leprechaun won't play matchmaker without a fight. Finally, real trouble comes in the form of the Banshee, and Darby will need all his quick wits to save his daughter from the wicked spirit.In the enchanted Emerald Isle, Darby O'Gill spins tall tales of leprechauns and banshees. Unfortunately, when he actually captures the leprechaun king and discovers their hidden gold, no one will believe him!A frisky old storyteller named Darby O'Gill is desperately seeking the proverbial pot of gold. There's just one tiny thing standing in his wayA wily old codger matches wits with the king of the leprechauns and helps play matchmaker for his daughter and the strapping lad who has replaced him as caretaker.",G
0033563,Dumbo,"The stork delivers a baby elephant to Mrs. Jumbo, veteran of the circus, but the newborn is ridiculed because of his truly enormous ears and dubbed ""Dumbo"". After being separated from his mother, Dumbo is relegated to the circus' clown acts; it is up to his only friend, a mouse, to assist Dumbo to achieve his full potential.Mrs. Jumbo sadly looks on how babies are delivered by stork to colleague circus-animals but as even a baby elephant makes a most cumbersome package, so her so is just last to arrive, but soon becomes a laughing stock for the jealous herd because of his more then jumbo-size ears, so he gets nick-named Dumbo. When she can't stomach the public making fun of her firstborn, she is locked up as mad elephant, and the taunted kid finds himself all alone; well, except for a self-appointed mentor-protector, Timothy Q. Mouse -subsize, yet ideal to scare the jealous herd- who keeps motivating Dumbo. Alas inspiring the circus director to make Dumbo the top (literally) of an elephant pyramid stunt literally brings the house down, so he's demoted to clown. When everything seems lost, they accidentally discover how they ended up in a tree with a bunch of crows...A young circus elephant is born with comically large ears and given the cruel nickname Dumbo. One day at a show, he is taunted by a group of kids, inciting his mother into a rage that gets her locked up. After Dumbo's ears cause an accident that injures many of the other elephants, he is made to dress like a clown and perform dangerous stunts. Everything changes when Dumbo discovers that his enormous ears actually allow him to fly, and he astounds everyone at the circus with his new talent.Ridiculed because of his enormous ears, a young circus elephant is assisted by a mouse to achieve his full potential.",G
0323642,Piglet's Big Movie,"When the gang from the Hundred Acre Wood begin a honey harvest, young Piglet is excluded and told that he is too small to help. Feeling inferior, Piglet disappears and his pals Eeyore, Rabbit, Tigger, Roo, and Winnie the Pooh must use Piglet's scrapbook as a map to find him. In the process they discover that this very small animal has been a big hero in a lot of ways.When Piglet comes up missing his Hundred Acre Wood friends use Piglet's own Book of Memories to find him, discovering along the way just how big a role he's played in their lives.",G
0065462,Beneath the Planet of the Apes,"Brent is an American astronaut, part of a team sent to locate missing fellow American astronaut, George Taylor. Following Taylor's known flight trajectory, the search and rescue team crash lands on an unknown planet much like Earth in the year 3955, with Brent being the only survivor of the team. What Brent initially does not know, much like Taylor didn't initially know when he landed here before Brent, is that he has landed back on Earth in the future, in the vicinity of what was New York City. Brent finds evidence that Taylor has been on the planet. In Brent's search for Taylor, he finds that the planet is run by a barbaric race of English speaking apes, whose mission is in part to annihilate the human race. Brent eventually locates some of those humans, who communicate telepathically and who live underground to prevent detection by the apes. These humans, who are in their own way as barbaric as the apes, want in turn to protect their species. Brent has to figure out a way to save himself under the circumstances, which may be more difficult to accomplish in the battle between the dominant species on this planet.Astronaut Brent is sent to rescue Taylor but crash lands on the Planet of the Apes, just like Taylor did in the original film. Taylor has disappeared into the Forbidden Zone so Brent and Nova try to follow and find him. He discovers a cult of humans that fear the Apes' latest military movements and finds himself in the middle. Tension mounts to a climactic battle between ape and man deep in the bowels of the planet. Sequel to ""Planet of the Apes."" Film 2 of the series of 5In an effort to find the missing astronaut Taylor, Brent goes on a rescue mission to the planet of the apes. Using the information he receives from the ape village that Taylor escaped from, Brent locates him in an underground fortress in the forbidden zone guarded by telepathic humans.A second astronaut crashes through the time barrier searching for the missing Taylor. The daring rescue mission leads to a subterranean city where mutant humans, who practice mind control, worship a weapon capable of destroying the entire planet.An astronaut, named Brent, is sent on a mission to find the missing astronaut crew from the first film, and he also lands on the planet of the apes where he stumbles upon an underground city where the last humans are in hiding from the dreaded ape army now out to exterminate mankind.The sole survivor of an interplanetary rescue mission searches for the only survivor of the previous expedition. He discovers a planet ruled by apes and an underground city run by telepathic humans.",G
0110763,The Pagemaster,"This is the story of a young boy named Richard Tyler, who spouts statistics about the possibility of accidents. So much so, he is scared to do anything that might endanger him, like riding his bike, or climbing into his treehouse. While riding his bike home, Richard finds shelter from a storm inside a nearby library. Richard slips and is knocked unconscious while exploring a rotunda in the library. Upon awakening, he is led on a journey through conflicts and events that resemble fictional stories, keeping him from finding the exit from the library.This is the story of a young boy named Richard Tyler, who knows the possibility about accidents. So much so, he is scared to do anything that might endanger him, like riding his bike, or climbing into his treehouse. While riding his bike home, Richard finds shelter from a storm inside a nearby library. While exploring the library, he is mystically transported into the unknown world of books, and he has to try and get home again. Along the way, Richard meets some interesting characters, like Fantasy, Adventure and Horror...A cowardly boy, who buries himself in accident statistics, enters a library to escape a storm, only to be transformed into an animated illustration by the Pagemaster. He has to work through obstacles from classic books to return to real-life.",G
0166813,Spirit: Stallion of the Cimarron,"A wild stallion is captured by humans and slowly loses the will to resist training. Yet throughout his struggles for freedom, the stallion refuses to let go of the hope of one day returning home to his herd.",G
0910970,WALL·E,"In a distant, but not so unrealistic, future where mankind has abandoned earth because it has become covered with trash from products sold by the powerful multi-national Buy N Large corporation, WALL-E, a garbage collecting robot has been left to clean up the mess. Mesmerized with trinkets of Earth's history and show tunes, WALL-E is alone on Earth except for a sprightly pet cockroach. One day, EVE, a sleek (and dangerous) reconnaissance robot, is sent to Earth to find proof that life is once again sustainable. WALL-E falls in love with EVE. WALL-E rescues EVE from a dust storm and shows her a living plant he found amongst the rubble. Consistent with her ""directive"", EVE takes the plant and automatically enters a deactivated state except for a blinking green beacon. WALL-E, doesn't understand what has happened to his new friend, but, true to his love, he protects her from wind, rain, and lightning, even as she is unresponsive. One day a massive ship comes to reclaim EVE, but WALL-E, out of love or loneliness, hitches a ride on the outside of the ship to rescue EVE. The ship arrives back at a large space cruise ship, which is carrying all of the humans who evacuated Earth 700 years earlier. The people of Earth ride around this space resort on hovering chairs which give them a constant feed of TV and video chatting. They drink all of their meals through a straw out of laziness and/or bone loss, and are all so fat that they can barely move. When the auto-pilot computer, acting on hastily-given instructions sent many centuries before, tries to prevent the people of Earth from returning by stealing the plant, WALL-E, EVE, the portly captain, and a band of broken robots stage a mutiny.In the distant future, humans abandon Earth because there is too much trash on it. WALL-E, with habit of picking up everything he finds interesting, lives alone on the planet with a pet cockroach. He has quite a collection of things, from lighters to a working iPod and even a small ring box (without the ring). He even has the last living plant. When a spaceship comes to earth and drops a sleek and dangerous probe EVE to look for a living plant, WALL-E falls in love with her. WALL-E gives her the plant, which makes EVE go into sleep mode. When a spaceship comes to take EVE back, WALL-E too goes with her. What follows is an adventure onboard the Axiom, where people move on hovering chairs and get liquid food which they suck up through a straw. Due to laziness, they have become so fat that they are unable to move. Due to hastily given instructions given to it, auto, the autopilot it tries to get rid of the plant which compels WALL-E, EVE, the pilot and some malfunctioning robots to find a way to retrieve the plant and save the earth.WALL-E, short for Waste Allocation Load Lifter Earth-class, is the last robot left on Earth. He spends his days tidying up the planet, one piece of garbage at a time. But during 700 years, WALL-E has developed a personality, and he's more than a little lonely. Then he spots EVE, a sleek and shapely probe sent back to Earth on a scanning mission. Smitten WALL-E embarks on his greatest adventure yet when he follows EVE across the galaxy.In the distant future, a small waste-collecting robot inadvertently embarks on a space journey that will ultimately decide the fate of mankind.",G
