id,title,plot,mpaa
0100788,Time Barbarians,"A warrior king has swordfights with ugly savages that crouch around the forest and snarl a lot. An evil bad guy, bent on doing evil things, kills his wife and flees to modern day Los Angeles. The warrior chases after him to avenge his wife's death.A medieval warrior chases a bad guy to modern day Los Angeles to avenge the death of his wife.",R
0100789,Crackdown,"Willis, a hardened DEA agent from the streets of New York, is given his toughest assignment -- to team up with a Colombian cop, Delgado, and find the connection of a drug shipments and the U.S. government.",R
0101004,Zandalee,"Bored with her marriage to burnt out poet turned corporate executive Thierry, Zandalee falls prey to an old friend of her husband, the manipulative and egotistical Johhny and becomes enmeshed in a sensual, passionate and destructive affair. But it isn't only the flames of their erotic affair that are fanned by the steamy heat of the deep New Orleans nights; hatred, desire and revenge stalk the lovers' with a relentless precision, and for Zandalee, the moment of truth arrives with a terrifying finality.",R
0101020,Once a Thief,"Once a Thief is an action/comedy/romance movie involving the plight of three master thieves (in the mode of Pink Panther). All three were raised by the same father and in fact were most certainly street orphans. The story begins with a successful art heist followed by a pledge to make this the last crime ever for the trio. The plot revolves around the theft of a mysterious ""cursed"" painting and how its obsession affects the family.A romantic and action packed story of three best friends, a group of high end art thieves, who come into trouble when a love-triangle forms between them.",R
0101252,29th Street,"Frank Pesce is the luckiest man alive in spite of his bad luck. Based on a true story, a man growing up in a tough New York neighborhood has a gift for finding himself in the worst possible jams...and always getting out. He is the first New York Lottery winner.On Christmas Eve, Frankie Pesce of Queens wins $6 million in New York State's first lottery. Instead of joy, he's in a rage, breaking church windows and disturbing the peace. At the police station, he tells his story. He's extraordinarily lucky, beginning with surviving a dicey childbirth; he works a little here and there; he still lives with his parents, his sister, her husband, and his older brother. They have noisy relationships, and at the heart is his father",R
0101253,Three Days to a Kill,"At a Chicago-area naval base, an ambassador is kidnapped. Later, a Navy officer calls his friend Cal for help. A Colombian drug lord is holding the ambassador, and the officer wants Cal to rescue the man. Cal convinces the officer to get a pardon for imprisoned explosives expert Rick, and together Cal and Rick form an uneasy partnership. They travel to meet Yolanda, a stripper who supposedly knows the location of this drug lord, named Perez (who looks like a creation out of Madame Tussaud's). Our threesome then sets about to rescue the ambassador. Cal, Rick, and Yolanda meet resistance at every turn; apparently Perez's men have the drop on them. After multiple shootouts, Cal convinces Yolanda to use her son as a pawn to draw Perez away from his home, and then all hell breaks loose.Two men try to rescue a kidnapped ambassador.",R
0101255,9 1/2 Ninjas!,"Joe Vogue, a ninja, butts heads with a real estate tycoon who has hired assassins to eliminate him. In addition to that he has to also protect and train a woman in the arts of ninjutsu.",R
0101256,976-Evil II,A seemingly harmless telephone service endows an evil teacher with powers from beyond the grave,R
0101272,The Addams Family,"The Addams step out of Charles Addams' cartoons. They live with all of the trappings of the macabre (including a detached hand for a servant) and are quite wealthy. Added to this mix is a crooked accountant and his loan shark and a plot to slip in the shark's son into the family as their long lost Uncle Fester. Can the false Fester find his way into the vault before he is discovered?When a man claiming to be Fester, the missing brother of Gomez Addams, arrives at the Addams' home, the family is trilled. However, Morticia begins to suspect the man is a fraud, since he cannot recall details of Fester's life. With the help of lawyer, Tully Alford, Fester manages to get the Addams clan evicted from their home. Gomez realizes the two men are conspiring to swindle the Addams fortune and that he must challenge Fester.For 25 years uncle Fester has been missing. An evil doctor finds out and introduces a fake Fester in an attempt to get the Adams Family's money. The youngest daughter has some doubts as to the sincerity of the new uncle Fester. The fake uncle adapts very well to the strange family. Can the doctor carry out her evil plans and take over the Adams Family's fortune?Con artists plan to fleece an eccentric family using an accomplice who claims to be their long-lost uncle.",PG-13
0101273,The Adjuster,"A reflection about what makes everyone's life unique, through the story of Noah's family. Noah is an adjuster, having sex with his customers. His wife Hera watches pornographic movies for the Board of Censors. They live with their son Simon and Hera's sister in a show-flat. One day, they meet Bubba, who wants to make a movie in their house.",R
0101276,Afraid of the Dark,"Lucas is a little boy who's going blind. The only thing that could save his eyesight is a risky eye operation that could either fix his eyes or blind him for good. Scared, lonely and half-blind, he lets his subconscious fears and desires and grim imagination run loose. He spends a lot of his time spying on people and visiting the local graveyard and the mausoleum. He starts seeing a creepy serial killer everywhere in town, who goes after blind women and stabs them in the eyes. Lucas doesn't tell anyone about this, not even his police officer father. He also starts seeing other people, who are not blind, as if they were blind. Lucas also develops an unhealthy interest in his much older stepsister, who is about to get married and leave their family home, and becomes jealous of her husband to be. Things culminate when he sees a dog he believes to be rabid, and when his pregnant mother finally gives birth to his baby sister. Can Lucas return from the brink of sanity and what, if anything, of the things he sees is real?A young boy, facing impending surgery on his eyes to try to stave off blindness, wanders his quiet London neighborhood. The only problem is he believes that a slasher is stalking blind women.A little boy, obsessed with blindness and violence, slowly gets trapped in his own delusions.",R
0101301,All I Want for Christmas,"""All I Want For Christmas"" is a comedy about two New York City children who launch a hilarious scheme to get what they most want this holiday season. Ethan, a practical older brother, and adorable Hallie, who knows how to charm her way out of a difficult situation, are intent on spending Christmas with their parents, Catherine and Michael, and grandmother Lillian. As Ethan and Hallie embark on their adventure, almost nothing goes exactly as they planned. Complicating things is a smarmy businessman named Toney Boer, who has taken an interest in Catherine. Ethan, meanwhile, is preoccupied with not only his parents' romantic dilemma, but also his own - one brought about by his new friendship with Stephanie, his first teenage crush. What evolves is an elaborate scheme involving mice, telephone calls and an ice-cream truck, as Ethan and Hallie try to achieve their goal with the help of Stephanie. The duo's primary obstacle is their mother's fiance, Tony. The children finally succeed with a little Christmas magic from Santa Claus.A brother and sister attempt to bring their divorced parents back together for Christmas.",G
0101309,Alligator II: The Mutation,A giant alligator runs riot in a small town with a lake connected to a sewer/drainage system. Typical plot; nobody believes the sightings until lots of people have been killed.,PG-13
0101316,The Lover,"It is French Colonial Vietnam in 1929. A young French girl from a family that is having some monetary difficulties is returning to boarding school. She is alone on public transportation when she catches the eye of a wealthy Chinese businessman. He offers her a ride into town in the back of his chauffeured sedan, and sparks fly. Can the torrid affair that ensues between them overcome the class restrictions and social mores of that time? Based on the semi-autobiographical novel by Marguerite Duras.An elderly French authoress, while writing her memoirs, is narrating the story of her first love. The year of that story is 1929, the place southern Indochina. Her mother and her two brothers lived in the house that came with the mother's poor paying teaching job, while she, across the Mekong River, lived in a boarding school dormitory in Saigon. The girl had an uneasy relationship with her family, largely because of her mother's inexplicable favoritism of her eldest brother, who was selfish, egotistical and thieving. The girl and her younger timid brother secretly wished he was dead. That year, she began a relationship with a Chinaman, who she met on the Mekong River ferry. He was western educated in Paris, came from a wealthy family and as such money was no issue for him, and had never worked a day in his life. They entered into their sexual relationship nervously if only because of the taboo associated with a relationship between races, and people of their respective ages (she telling him that she was eighteen, he telling her he was thirty-two). As time progressed, they were more open to the world at least about having a relationship. Her family disapproved of what they knew she was doing, while still savoring the Chinaman's showering of money at them. They talked openly to each other about their non-existent future, as she could never marry a Chinaman, and he was already betrothed to a woman from a wealthy family, she who he would not even meet until the wedding ceremony. But both began to think that there was the possibility of a future ""them"", driven by their passion and desire.In 1929 French Indochina, a French teenage girl embarks on a reckless and forbidden romance with a wealthy, older Chinese man, each knowing that knowledge of their affair will bring drastic consequences to each other.",R
0101317,Lovers: A True Story,"Set in '50s Spain, a young man (Sanz) leaves the army and looks for a job so he and his fiancée (Verdu) can get married. He rents a room from a widow (Abril), and shortly begins a torrid affair with her. The fiancée figures it out and decides to win him back by offering herself to him and taking him to meet her family. Ultimately he has to make a decision. Based on a true story.Madrid, 1950. Francisco, detto Paco, un giovane di origine campagnola, dopo aver terminato il servizio militare, decide di stabilirsi a Madrid. Il suo comandante gli trova un lavoro e lui vorrebbe fare soldi in fretta per sposare la sua fidanzata Trini, che lo aspetta al paese. Paco alloggia nel frattempo presso Luisa, una giovane vedova molto attraente, che lo conquista e con la quale inizia una calda ed intensa relazione sessuale. Fra i due si intromette la ragazza di Paco, che un giorno arriva in città e che complica il loro ""feeling"". La storia si conclude nel sangue, sul sagrato di una chiesa.",R
0101318,The Lovers on the Bridge,"Set against Paris' oldest bridge, the Pont Neuf, while it was closed for repairs, this film is a love story between two young vagrantsAlex, who's homeless and addicted to alcohol, and Michèle, who's losing her sight, form a relationship while sleeping rough on Paris's Pont-Neuf bridge.",R
0101320,Ambition,"Mitchell Osgood dreams of being a famous writer, but the book he has written constantly is rejected by the editors. When the psychopathic killer Albert Merrik is released from prison after 15 years, Osgood believes that writing down the history of his crimes could be his breakthrough. Although he refuses to talk to him at first, Osgood follows him around and offers him a job in his book shop. To get the right impressions for his book, he feels that he has to experience Merrik psychopathic again...",R
0101324,American Friends,"Francis Ashby, a senior Oxford don on holiday alone in the Alps, meets holidaying American Caroline and her companion Elinor, the blossoming Irish-American girl she adopted many years before. Ashby finds he enjoys their company, particularly that of Elinor, and both the women are drawn to him. Back at Oxford he is nevertheless taken aback when they arrive unannounced. Women are not allowed in the College grounds, let alone the rooms. Indeed any liaison, however innocent, is frowned on by the upstanding Fellows.",PG
0101325,American Kickboxer,"Kickboxing champion B.J. is jailed for an accidental murder thanks to the testimony of his arch-nemesis Denard. A year later, B.J. is released and then challenged by Denard for $100,000. Will B.J. accept and get even with Denard?",R
0101327,American Shaolin,"After being humiliated in the ring by a dirty kickboxer who pulled down his shorts and then hit him, a martial arts master decides to travel to China and enter a monastery where he may learn the Shaolin form of fighting. The film then veers into ""Karate Kid"" territory where the novice humiliates himself at every turn, is tolerated as a foreigner, and still comes out a champion. The monastery teaches non-violence, but everyone knows that sooner or later the student will catch up with the bad guy.",PG-13
0101329,An American Tail: Fievel Goes West,"Some time after the Mousekewitz's have settled in America, they find that they are still having problems with the threat of cats. That makes them eager to try another home out in the west, where they are promised that mice and cats live in peace. Unfortunately, the one making this claim is an oily con artist named Cat R. Waul who is intent on his own sinister plan. Unaware of this, the Mousekewitz's begin their journey west, while their true cat friend, Tiger, follows intent on following his girlfriend gone in the same direction.A family of Emigre mice decide to move out to the west, unaware that they are falling into a trap perpetrated by a smooth talking cat.",G
0101343,And You Thought Your Parents Were Weird,"Two boys follow in their late father's footsteps by inventing weird and wonderful gadgets. Trouble lies ahead when, after a Halloween party, the spirit of their father ends up in the latest invention, a robot.Two inventor brothers create a working robot that is also inhabited by the spirit of their dead father.",PG
0101356,Another You,"George has been in a mental hospital for three years and is finally ready to go out into the real world again. Eddie Dash, a dedicated con man, is supposed to keep him out of trouble, but when people begin to recognize George as the missing millionaire Abe, Eddie wants to take advantage of the situation.",R
0101368,Severed Ties,"Harrison is a young scientist who grew up under the thumb of his domineering rich posh mother Helena. Even in his adulthood she still has a stranglehold over him since she's financing his research based on the discoveries of his late scientist father. His obsession is to successfully use lizard DNA to stimulate regeneration of dead or dying tissue which could lead to cure for cancer or even regeneration of lost limbs in humans. He soon has a breakthrough but all his dreams are crushed when he learns that his manipulative mother and her unscrupulous boyfriend Dr. Hans Vaughn are planing to take all of his research from him and sell it as their own. Enraged, Harrison has an argument with his mother and Vaughn which ends in tragedy when an automated door accidentally sever his right arm. Harrison injects himself with his regeneration serum to try and grow a new hand. Unfortunately, it turns out that his new scaly limb has a killer mind of its own. Harrison runs away and finds shelter in the sewers with a bunch of homeless crippled war veterans led by Stripes. Harrison decides to use his serum on them in an attempt to get them to help him get his research back.When a regeneration experiment on his severed arm grows a deadly reptilian creature instead of a limb, a mad scientist uses the serum on homeless crippled veterans to create an army and get his research back from his evil mother.",R
0101369,The Art of Dying,"A cinematographer and his assistant are attracting aspiring young actors and actresses by getting them to try out for their movie. Once filming, the evil cameraman actually kills them. The detective on the case has his hands full trying to help out runaways with stars in their eyes. When some of the people he knows turn up dead, he takes it personally, and as he gets closer to the truth his girlfriend is endangered.",R
0101371,Article 99,"A group of doctors in a veteran's hospital must contend with their hopeless situationUn gruppo di medici, un pò eroi e un pò incoscienti, rischia carriera e futuro per cercare di curare (operando senza permesso e trafugando i mezzi tecnici dell'ospedale stesso) i reduci di guerra ricoverati in un ospedale nord-Americano, lottando contro la burocrazia governativa e le mire carrieristiche del direttore amministrativo dell'ospedale. Alla fine, dopo una ""rivolta"" di medici, infermieri e degenti, il direttore viene rimosso. Ma la burocrazia rimane in agguato!",R
0101372,L'assassin jouait du trombone,Marleau travaille comme gardien de nuit dans un grand studio de production de films ,G
0101373,At Play in the Fields of the Lord,"Martin and Hazel Quarrier are small-town fundamentalist missionaries sent to the jungles of South America to convert the Indians. Their remote mission was previously run by the Catholics, before the natives murdered them all. They are sent by the pompous Leslie Huben, who runs the missionary effort in the area but who seems more concerned about competing with his Catholic 'rivals' than in the Indians themselves. Hazel is terrified of the Indians while Martin is fascinated. Soon American pilot Lewis Moon joins the Indian tribe but is attracted by Leslie's young wife, Andy. Can the interaction of these characters and cultures, and the advancing bulldozers of civilization, avoid disaster?",R
0101391,Baby on Board,"When the widow of an accidentally murdered mob bookkeeper goes looking for revenge she mistakenly finds it in this slapstick comedy of errors. Forced to go on the lam with her young daughter, she hooks up with an unlucky cabbie for the ride of their lives through New York City.",PG
0101393,Backdraft,"A rookie firefighter tries to earn the respect of his older brother and other firefighters while taking part in an investigation of a string of arson/murders. This detailed look into the duties and private lives of firemen naturally features widespread pyrotechnics and special effects.As a child Brian McCafferty watched his firefighter father die. Years later he joins his brother, Steven in the force by becoming a rookie firefighter. There is a history of conflict between the two brothers that is heated up by working together. With this background, a series of suspicious fires are set, each made to kill a specific person. After becoming frightened at a fire, Brian pulls strings to get into an investigative office and finds that he is now not putting out the arsonist's fires, but trying to track him down.Brian McCaffrey's father's a fireman and he was there, as a child, when his father died. When he grew he tried to be a fireman but quit and left town and for a few years tried other jobs. He would eventually return and try to be fireman again. However, he finds himself working under his brother Stephen whom he doesn't exactly have a good relationship with. When Brian gets his picture in the paper and is lauded as a hero when in fact it was a mistake, a politician offers him a job working under the department's arson investigator, Donald Rimgale. It seems that Ringale is working some unusual fires wherein someone is killed. Brian initially refuses but when he has too many confrontations with Stephen, he takes the job. And he gets a lesson on what it means to be a fireman.Two Chicago firefighter brothers, who don't get along, have to work together while a dangerous arsonist is on the loose.",R
0101404,The Ballad of the Sad Cafe,"A tangled triangle. In the rural South of the early 20th century, Miss Amelia is the town eccentric, selling corn liquor and dispensing medicine. She takes in her half-sister's son, a diminutive crook-back named Lymon. He suggests they open a café in the downstairs of her large house. Marvin Macy gets out of prison and returns to town; turns out he was married to Amelia but it wasn't consummated. He pleaded, then got angry. Is he back for revenge? Eventually, Amelia and Marvin stage a no-holds-barred fight in the café. Lymon's complicated response to Marvin and to Cousin Amelia figures in the resolution.Marvin Macy doesn't return from prison to marry Amelia, he married Amelia before he went to prison, was rejected by her on their wedding night and was permanently relegated to sleep in a shed. She ruthlessly drives him away. Marvin returns after being released from prison to spoil the brief period of happiness Amelia has enjoyed with her newfound relation, which leads to the bare-knuckle fight.",PG-13
0101410,Barton Fink,"In 1941, New York intellectual playwright Barton Fink comes to Hollywood to write a Wallace Beery wrestling picture. Staying in the eerie Hotel Earle, Barton develops severe writer's block. His neighbor, jovial insurance salesman Charlie Meadows, tries to help, but Barton continues to struggle as a bizarre sequence of events distracts him even further from his task.Set in 1941, a newly successful New York playwright accepts an offer to write movie scripts in LA, and finds himself with writer's block when required to do a B-movie wrestling script, the only relief coming from a traveling salesman living next door.Barton Fink is a troubled New York playwright obsessed with bringing his new idea of ""Theater of the Common Man"" to the producers he loves to hate. After his first budding success his agent convinces him to travel to Los Angeles to write for Capital Pictures. When he arrives he checks into the dark Hotel Earle and meets with Capital Pictures President Jack Lipnick, who tells him of the movie he's writingA renowned New York playwright is enticed to California to write for the movies and discovers the hellish truth of Hollywood.",R
0101412,Beastmaster 2: Through the Portal of Time,"Dar is a warrior who can talk to the beasts. He is forced to travel to Earth to stop his evil brother from stealing an atomic bomb and turning their native land from a desert into, well - a desert.",PG-13
0101414,Beauty and the Beast,"Having lived a life in selfishness, a young prince is cursed by a mysterious enchantress to having the appearance of a monstrous beast. His only hope is to learn to love a young woman and earn her love in return in order to redeem himself. Years later, his chance shows itself when a young maiden named Belle offers to take her ill father's place as his prisoner. With help from the castle's enchanted staff, Belle learns to appreciate her captor and immediately falls in love with him. Back in the village however, an unscrupulous hunter has his own plans for Belle.An arrogant young prince and his castle's servants fall under the spell of a wicked enchantress, who turns him into the hideous Beast until he learns to love and be loved in return. The spirited, headstrong village girl Belle enters the Beast's castle after he imprisons her father Maurice. With the help of his enchanted servants, including the matronly Mrs. Potts, Belle begins to draw the cold-hearted Beast out of his isolation.Belle is a girl who is dissatisfied with life in a small provincial French town, constantly trying to fend off the misplaced ""affections"" of conceited Gaston. The Beast is a prince who was placed under a spell because he could not love. A wrong turn taken by Maurice, Belle's father, causes the two to meet.Prince Adam was cursed to a beast form by Enchantress who saw no love in his arrogant heart for others. The one way he could break the spell was to learn to love another and earn her love in return before the last petal from his enchanted rose fell, which would bloom until his twenty-first birthday. But who could ever learn to love a beast? Ten years later, Maurice, an inventor from a nearby village, becomes lost in the woods and seeks shelter in the Beast's castle, the Beast imprisons him for trespassing. His daughter Belle, a bookworm who dreams of life outside her provincial village, finds him trapped in the castle and offers her place instead. The Beast accepts with a promise she'll remain in the castle forever. In the beginning Belle views him as nothing more than a monster, he views her as difficult and stubborn. But the two soon taste the bitter-sweetness of finding ""you can change and learning you were wrong"".A selfish prince is cursed to become a monster for the rest of his life, unless he learns to fall in love with a beautiful young woman he keeps prisoner.",G
