id,title,plot,mpaa
0468569,The Dark Knight,"Set within a year after the events of Batman Begins, Batman, Lieutenant James Gordon, and new district attorney Harvey Dent successfully begin to round up the criminals that plague Gotham City until a mysterious and sadistic criminal mastermind known only as the Joker appears in Gotham, creating a new wave of chaos. Batman's struggle against the Joker becomes deeply personal, forcing him to ""confront everything he believes"" and improve his technology to stop him. A love triangle develops between Bruce Wayne, Dent and Rachel Dawes.The follow-up to Batman Begins, The Dark Knight reunites director Christopher Nolan and star Christian Bale, who reprises the role of Batman/Bruce Wayne in his continuing war on crime. With the help of Lt. Jim Gordon and District Attorney Harvey Dent, Batman sets out to destroy organized crime in Gotham for good. The triumvirate proves effective. But soon the three find themselves prey to a rising criminal mastermind known as The Joker, who thrusts Gotham into anarchy and forces Batman closer to crossing the fine line between hero and vigilante.Gotham's new district attorney has been elected. His name is Harvey Dent, and he has a radical new agenda that threatens to take down Gotham's organized crime underworld once and for all with an iron fist. But the emergence of the rogue vigilante known as Batman has caused problems for Dent and his agenda. A new criminal mastermind known only as ""The Joker"" has arrived and aims to take Gotham out from under Harvey Dent's iron fist. The Joker stages a masterfully planned bank robbery and robs the Gotham mob blind. He uses this money to stage a series of horrific and strategic attacks against the city and its people - each one carefully planned and aimed at Dent and Batman while causing the rest of the city to enter panic mode. Meanwhile, Batman thinks he might have found a lead to The Joker thanks to Wayne Enterprises' dealings with a shady Chinese banker, and that takes Batman and Alfred to Hong Kong. The Joker has no rules, but Batman has only one, and the Joker aims to make Batman break his only rule. But who will be the one to take him out - will it be rogue vigilante Batman or will it be elected official Harvey Dent, the new hero with a face?One year after the events of Batman Begins, Batman, Gordon, and the new DA, Harvey Dent plan to launch an attack on the mob by arresting the shady accountant of the mob, Lau. Lau is abducted from his building by Batman and is thrown into jail. Lau divulges the secrets which results in almost all the mob bosses thrown in jail. The desperate mob bosses turn to the Joker, a sadistic psychopath with green hair, completely yellow teeth and a custom purple suit. The Joker kills a judge, the commissioner of police and tries to kill the Mayor and Harvey. The acts of Joker produces anarchy and chaos of in the people of Gotham forcing Batman to come to terms to which may seem to be his greatest test to fight injustice and come closer to the fine line between hero and vigilante.With the help of allies Lt. Jim Gordon and DA Harvey Dent, Batman has been able to keep a tight lid on crime in Gotham City. But when a vile young criminal calling himself the Joker suddenly throws the town into chaos, the caped Crusader begins to tread a fine line between heroism and vigilantism.When the menace known as the Joker emerges from his mysterious past, he wreaks havoc and chaos on the people of Gotham. The Dark Knight must accept one of the greatest psychological and physical tests of his ability to fight injustice.",PG-13
1074638,Skyfall,"When Bond's latest assignment goes gravely wrong and agents around the world are exposed, MI6 is attacked forcing M to relocate the agency. These events cause her authority and position to be challenged by Gareth Mallory (Ralph Fiennes), the new Chairman of the Intelligence and Security Committee. With MI6 now compromised from both inside and out, M is left with one ally she can trustBond's mission is to keep a computer drive that has a list of British agents from being used against them. He chases the man who has it and they have a brawl on top of a train. Eve, an agent sent to assist Bond has them in her cross hairs but hesitates to take the shot because she might hit Bond but M orders her to take it. Which she does and hits Bond who falls into the river and is believed to be dead. A few months later, the British government is upset with MI6 for losing the list; specifically with M. She is told that she'll be allowed to retire but she refuses to leave until the matter is resolved. So she returns to HQ to work on it but as she arrives, there's an explosion. In the meantime, Bond, who is not dead, has been laying low. When he learns of what happened, he returns. And M tasks him with finding the one who has the information. He eventually learns that the man who has it, Silva, is someone from M's past and who has it in for her.When one MI6 hard disc with the identities of NATO's agents is stolen, James Bond chases the agent through Istanbul with the support of the local field agent Eve. M (Judi Dench) orders Eve to shoot the agent on the top of a train, but she misses the target and hits 007 that falls in a river and is presumed dead. When M's computer is hacked, the MI6 building is blown-up and the agency moves to an ancient bunker that belonged to Churchill. Then, five MI6 agents have their identities exposed and three of them are executed and M has her authority and procedure questioned by her superior Gareth Mallory. Out of the blue, 007 reappears from the shadows and hunts down the responsible for the theft of the HD. He reaches Severine and uses her to find the responsible for the actions, the former top-notch MI6 agent Tiago Rodriguez, a.k.a. Silva, who had been betrayed by M and now is seeking out revenge against the veteran leader of the MI6.Bond's latest adventure takes him deep to the heart of Istanbul to retrieve a hard disc containing the names of NATO operatives, their whereabouts, and their real identities. Unfortunately the mission goes horribly awry and ends with Bond getting shot while on the roof of a train. Fortunately Bond survives and is enjoying life on a remote Mediterranean island. But an untimely and horrific attack compromises MI-6, kills 6 agents, and ultimately compromises M herself. Then a mysterious hacker, using the newly obtained data, outs the agents on Youtube - compromising their missions and identities. That brings Bond back out of retirement. He then goes on a cat and mouse chase after a reclusive computer hacker - taking him to Shanghai, Macau, Japan, and ultimately back to London and his childhood home called ""Skyfall"" While the hacker has ties to M's past, it puts Bond's loyalty to the ultimate test. Will he be able to stop it before it's too late?When a mission to kill a fierce assassin goes wrong for James Bond, a hard drive is stolen which contains the names and whereabouts of several agents from MI6. This forces M to relocate the agency underground and her position challenged by Garreth Mallory, the new head of Intelligence and Security Committee. But M finds that her past comes back to punch her in the face when mysterious messages begin haunting her. Now Bond is sent to track down the hard drive and who has it. Aided by Eve and the new Q, Bond's trail leads him to a mysterious hacker named Silva, whose intentions are yet to be shown.Bond's loyalty to M is tested when her past comes back to haunt her. When MI6 comes under attack, 007 must track down and destroy the threat, no matter how personal the cost.",PG-13
6791096,I Feel Pretty,"In I FEEL PRETTY a woman who struggles with feelings of deep insecurity and low self-esteem, that hold her back everyday, wakes from a brutal fall in an exercise class believing she is suddenly a supermodel. With this newfound confidence she is empowered to live her life fearlessly and flawlessly, but what will happen when she realizes her appearance never changed?A woman struggling with insecurity wakes from a fall believing she is the most beautiful and capable woman on the planet. Her new confidence empowers her to live fearlessly, but what happens when she realizes her appearance never changed?",PG-13
1211837,Doctor Strange,"Marvel's ""Doctor Strange"" follows the story of the talented neurosurgeon Doctor Stephen Strange who, after a tragic car accident, must put ego aside and learn the secrets of a hidden world of mysticism and alternate dimensions. Based in New York City's Greenwich Village, Doctor Strange must act as an intermediary between the real world and what lies beyond, utilising a vast array of metaphysical abilities and artifacts to protect the Marvel Cinematic Universe.After a horrible car accident, brilliant neurosurgeon Stephen Strange must find a way and a cure to healing his hands. His quest brings him to Kamar-Taj in Nepal where he studies under the Ancient One, who teaches him the ways of magic and alternate realities. With new skills of interdimensional travel and spells, Strange soon discovers that he must protect the world from a deadly enemy who is out to destroy it.Stephen Strange is a surgeon with a God complex. When he gets in an accident and his hands are injured, he feels as if his life is over. His therapist tells him of a guy he knew who couldn't walk but is now walking again. The therapist tells Strange where he can find the man and he tells Strange he did it with his mind, he went to a place called Kamar-Taj and there he was taught how to use his mind to heal himself. Strange goes there to seek the ones who taught him. He finds them and learns that they use mystic arts and they take Strange in, reluctantly and teach him. Strange learns that a former member is planning something and tries to stop him. But he also learns that his teacher is keeping a secret too.After a car accident robs him of the use of his hands, brilliant but arrogant neurosurgeon Stephen Strange (Benedict Cumberbatch) sets out on a journey to heal his hands, but gets caught up in the teachings of the mystic arts, from the sorcerer supreme, the ancient one (Tilda Swinton) which strange must learn to use if he wants to save the world from a vengeful former student (Mads Mikkelsen) seeking eternal life.In New York, the arrogant Dr. Stephen Strange is a talented neurosurgeon with a huge ego. After a car accident, Dr. Strange damages his fingers and loses control of his hands. The surgeon, Christine Palmer, who was his lover, tries to help him. But Dr. Strange unsuccessfully spends his savings searching for an experimental treatment for his fingers. When Dr. Strange learns that the paraplegic Jonathan Pangborn walked again, he seeks him out and is told he was healed in Kamar-Taj. Dr. Strange travels to Katmandu where he meets the sorcerer Mordo and is introduced to The Ancient One. She discloses the astral plan and other dimensions to him and explains that Earth is protected in the mystical plan by three Sanctums (in New York, London, and Hong Kong). However, her former protégé, Kaecilius, has contacted the powerful demon Dormammu in the Dark Dimension and wants to destroy the three Sanctums with his minions to let the Dark Dimension, where time does not exist and anyone can live forever, to rule the world. Will The Ancient One, Dr. Strange and Mordo save the world?While on a journey of physical and spiritual healing, a brilliant neurosurgeon is drawn into the world of the mystic arts.",PG-13
2345759,The Mummy,"Though safely entombed in a crypt deep beneath the unforgiving desert, an ancient princess, whose destiny was unjustly taken from her, is awakened in our current day bringing with her malevolence grown over millennia, and terrors that defy human comprehension.After being betrayed and having her destiny wrongfully taken from her, an ancient princess is back with a vengeance and determined to take back all that should have been hers, including the world, bringing with her terrors that defy human comprehension.Soldier of fortune Nick Morton (Tom Cruise) accidentally discovers the tomb of a female pharaoh of ancient Egypt named Ahmanet (Sofia Boutella) during a firefight in the Middle East. But when he and a British Egyptologist (Annabelle Wallis) try to excavate the findings, the resurrected Ahmanet emerges from her sarcophagus with a plot to enslave humanity.An ancient Egyptian princess is awakened from her crypt beneath the desert, bringing with her malevolence grown over millennia, and terrors that defy human comprehension.",PG-13
0413300,Spider-Man 3,"Peter Parker has finally managed to piece together the once-broken parts of his life, maintaining a balance between his relationship with Mary-Jane and his responsibility as Spider-Man. But oes to face both villains, Harry is told the truth about his father and decides to help Spider-Man. The final battle comes down to Harry and Spider-Man against Venom and Sandman. Who will win?Life finally feels good for Peter Parker. He has managed to balance life as both Spider-Man and as Mary Jane's boyfriend. He is even planning on proposing to MJ. But life isn't always going to be easy for the webbed hero. Harry Osborn still hasn't forgiven Peter for the death of his father. He has developed the perfect technology and crowns himself the 'New Goblin'. Harry isn't the only problem. It is revealed that an escaped convict, Flint Marko is the real killer of Peter's uncle. After an accident, he is now the invincible 'Sandman', who has teamed up with Venom to target the superhero, who is struggling to handle his life.A strange black entity from another world bonds with Peter Parker and causes inner turmoil as he contends with new villains, temptations, and revenge.",PG-13
1707386,Les Misérables,"Jean Valjean, known as Prisoner 24601, is released from prison and breaks parole to create a new life for himself while evading the grip of the persistent Inspector Javert. Set in post-revolutionary France, the story reaches resolution against the background of the June Rebellion.Based on the novel by Victor Hugo, 'Les Miserables' travels with prisoner-on-parole, 24601, Jean Valjean, as he runs from the ruthless Inspector Javert on a journey beyond the barricades, at the center of the June Rebellion. Meanwhile, the life of a working class girl with a child is at turning point as she turns to prostitution to pay money to the evil innkeeper and his wife who look after her child, Cosette. Valjean promises to take care of the child, eventually leads to a love triangle between Cosette, Marius who is a student of the rebellion, and Eponine, a girl of the streets. The people sing of their anger and Enjolras leads the students to fight upon the barricades.Based on the classic novel, Les Misérables, by Victor Hugo, and the classic Broadway stage show of the same name, Les Misérables is the story of Jean Valjean, a prisoner who breaks parole, and the police inspector, Javert, who tries to hunt him down for breaking parole. Valjean tries to help a poor factory worker, Fantine, by saving her child, Cosette, from innkeepers who are holding her captive as a slave. Marius, a war veteran during the battles of post-French Revolution, falls for Cosette, but their lives change forever when the war turns more gruesome than expected.After 19 years as a prisoner, Jean Valjean is freed by Javert, the officer in charge of the prison workforce. Valjean promptly breaks parole but later uses money from stolen silver to reinvent himself as a mayor and factory owner. Javert vows to bring Valjean back to prison. Eight years later, Valjean becomes the guardian of a child named Cosette after her mother's death, but Javert's relentless pursuit means that peace will be a long time coming.In 19th-century France, Jean Valjean, who for decades has been hunted by the ruthless policeman Javert after breaking parole, agrees to care for a factory worker's daughter. The decision changes their lives forever.",PG-13
5439796,Logan Lucky,"When Jimmy Logan (Channing Tatum) gets fired, he convinces his brother Clyde (Adam Driver) and sister Mellie (Riley Keough) to help him rob the Charlotte Motor Speedway during a NASCAR Race. But they will need the help of Joe Bang (Daniel Craig), a convicted safe-cracker who is currently doing time. All they have to do is break Joe out, blow the racetrack vault, get away with the cash, return Joe to prison, and get Jimmy to his daughter's beauty pageant on time. What could possibly go wrong? Well, there is the Logan family curse .Two brothers attempt to pull off a heist during a NASCAR race in North Carolina.",PG-13
0092890,Dirty Dancing,"In 1963, Frances ""Baby"" Houseman, a sweet daddy's girl, goes with her family to a resort in upstate New York's Catskill Mountains. Baby has grown up in privileged surroundings and all expect her to go on to college, join the Peace Corps and save the world before marrying a doctor, just like her father. Unexpectedly, Baby becomes infatuated with the camp's dance instructor, Johnny Castle, a man whose background is vastly different from her own. Baby lies to her father to get money to pay for an illegal abortion for Johnny's dance partner. She then fills in as Johnny's dance partner and it is as he is teaching her the dance routine that they fall in love. It all comes apart when Johnny's friend falls seriously ill after her abortion and Baby gets her father, who saves the girl's life. He then learns what Baby has been up to, who with and worse, that he funded the illegal abortion. He bans his daughter from any further association with ""those people"". In the first deliberately willful action of her life, Baby later sneaks out to see Johnny, ostensibly to apologize for her father's rudeness, and ends up consummating her relationship with Johnny. A jealous fellow vacationer sees Baby sneaking out of Johnny's bungalow the next morning, and in an act of retribution, tells management that he is responsible for a theft the evening before, knowing he would not furnish his real whereabouts.Spending the summer at a Catskills resort with her family, Frances ""Baby"" Houseman falls in love with the camp's dance instructor, Johnny Castle.",PG-13
5308322,Happy Death Day,"A teenage girl, trying to enjoy her birthday, soon realizes that this is her final one. That is, if she can figure out who her killer is. She must relive that day, over and over again, dying in a different way each time. Can she solve her own murder?After a night of hard-partying and heavy-drinking, the self-centred college student and sorority sister, Tree Gelbman, wakes up on the morning of her birthday with a serious hangover in the dorm of a guy she can't recall his name. As Tree goes about her day, little does she know that everything that happens now or will happen during the course of the day, is a twisted déjà vu of a reality that repeats itself again and again, until her brutal murder at night by a masked madman. With every repetition, or better yet, resurrection, Tree gets a little bit closer to the identity of her unknown killer, however, figuring out who he or she may be, always ends up with Tree's death. Wake up, figure out the killer, die, repeat. After all, practice makes perfect.A college student must relive the day of her murder over and over again, in a loop that will end only when she discovers her killer's identity.",PG-13
1735898,Snow White and the Huntsman,"Snow White, imprisoned daughter of the late king, escapes just as the Magic Mirror declares her the source of the Evil Queen's immortality. The Queen sends her men, led by a local huntsman, to bring her back. But upon her capture, the huntsman finds he's being played and turns against the Queen's men, saving Snow White in the process. Meanwhile, Snow's childhood friend, William, learns that she is alive and sets off to save her.Once upon a time, King Magnus and his Queen have a beautiful daughter, Snow White, who is raised with her best friend William. When the Queen passes away, the King grieves her death but has to fight against a dark invader army. He rescues a beautiful prisoner, Ravenna, and on the next day he marries her. On the wedding night, Ravenna stabs King Magnus in the chest and brings the enemy army led by her brother Finn that destroys the King's army. Ravenna imprisons Snow White in the Northern Tower of the castle while William, his father The Duke and a few survivors escape from the castle. Years later, the kingdom is completely depleted and Queen Ravenna, who is an evil witch, keeps her beauty by draining the youth of young ladies. When the Magic Mirror tells that Snow White would be the source of her immortality, she asks Finn to bring the princess to her. However, Snow White escapes and flees to the Dark Forest. Queen Ravenna brings a Huntsman that misses his wife and she promises to bring her back to life provided he catches and brings Snow White to her. But when he captures Snow White, he discovers that the evil Queen lied to him and he becomes the protector of the princess. Meanwhile William learns that Snow White is alive and he heads to join Finn's men to meet her. The Huntsman and Snow White meet the eight dwarfs that bring them to the magic Fairytale Land. When they are attacked by Finn and his men, William also finds them and the group heads to the Duke's castle with the intention of beginning an uprising against the evil Ravenna.After the untimely death of the kind Queen Eleanor, King Magnus enchanted by the prisoner Ravenna's beguiling beauty decides to marry her, only to be seduced to his death on the night of their wedding. As a result, the demonic usurper, Queen Ravenna, banishes her stepdaughter, Snow White, to the castle's prison, dreaming of becoming an immortal, however, to change into an everlasting entity and the fairest of them all, the Queen will need Snow White's pure heart. As Snow White escapes, the huntsman sent to capture her will soon join forces with the realm's rightful Princess and a courageous army of insurgents thirsting for freedom. But is courage alone enough against Ravenna's dark sorcery?In a twist to the fairy tale, the Huntsman ordered to take Snow White into the woods to be killed winds up becoming her protector and mentor in a quest to vanquish the Evil Queen.",PG-13
5104604,Isle of Dogs,"An outbreak of dog flu has spread through the city of Megasaki, Japan, and Mayor Kobayashi has demanded all dogs to be sent to Trash Island. On the island, a young boy named Atari sets out to find his lost dog, Spots, with the help of five other dogs... with many obstacles along the way.Set in Japan, Isle of Dogs follows a boy's odyssey in search of his lost dog.",PG-13
0499549,Avatar,"When his brother is killed in a robbery, paraplegic Marine Jake Sully decides to take his place in a mission on the distant world of Pandora. There he learns of greedy corporate figurehead Parker Selfridge's intentions of driving off the native humanoid ""Na'vi"" in order to mine for the precious material scattered throughout their rich woodland. In exchange for the spinal surgery that will fix his legs, Jake gathers intel for the cooperating military unit spearheaded by gung-ho Colonel Quaritch, while simultaneously attempting to infiltrate the Na'vi people with the use of an ""avatar"" identity. While Jake begins to bond with the native tribe and quickly falls in love with the beautiful alien Neytiri, the restless Colonel moves forward with his ruthless extermination tactics, forcing the soldier to take a stand - and fight back in an epic battle for the fate of Pandora.On the lush alien world of Pandora live the Na'vi, beings who appear primitive but are highly evolved. Because the planet's environment is poisonous, human/Na'vi hybrids, called Avatars, must link to human minds to allow for free movement on Pandora. Jake Sully, a paralyzed former Marine, becomes mobile again through one such Avatar and falls in love with a Na'vi woman. As a bond with her grows, he is drawn into a battle for the survival of her world.In the future, Jake, a paraplegic war veteran, is brought to a moon, Pandora, which is inhabited by the Na'vi, a humanoid race with their own language and culture. Those from Earth find themselves at odds with each other and the local culture.A paraplegic marine dispatched to the moon Pandora on a unique mission becomes torn between following his orders and protecting the world he feels is his home.",PG-13
